ticket_id,enteredDate,lastModified,closedDate,status,contactMethod,category,description,department,location,city,state,zip,latitude,longitude
154746,"2016-08-11 11:04:29","2019-01-10 08:51:31","2016-08-22 09:34:31",closed,"Phone Call","Blocked Sidewalk","these folks planted some bushes between the sidewalk and the street. The bushes grow each year and block at least 1/2 of the sidewalk. they also protrude into the street.",,"410 N Park Ridge RD",Bloomington,IN,47408,39.16952514648438,-86.47484588623047
154772,"2016-08-12 09:09:35","2019-01-10 08:51:31","2016-08-31 10:33:48",closed,Other,"Blocked Sidewalk","West side of Madison, south of 14th. City-owned property is unmaintained. Overgrowth blocks crucial sidewalk.",,"877-899 North Rogers Street",Bloomington,IN,,39.17542648315430,-86.53788757324219
154933,"2016-08-17 14:37:56","2016-09-11 22:02:05","2016-08-23 08:25:08",closed,Other,"Blocked Sidewalk","brush intruding on walkway from Arlington school toward pedestrian connector to Skyline forcing my wheelchair into the grass","Utilities T & D",,Bloomington,IN,,,
154935,"2016-08-17 15:27:49","2016-09-11 22:02:05","2016-08-31 10:49:36",closed,Other,"Blocked Sidewalk","Almost every day a different car is parked on the sidewalk here (despite having a full private driveway)",,"411 W 2nd St",Bloomington,IN,,39.16130065917969,-86.53810119628906
154981,"2016-08-19 12:24:21","2016-09-11 22:02:05","2016-08-31 10:44:09",closed,Other,"Blocked Sidewalk",,,"502 S Washington ST",Bloomington,IN,47401,39.16117095947266,-86.53267669677734
155144,"2016-08-24 12:37:27","2016-10-14 14:09:15","2016-10-14 14:09:15",closed,Other,"Blocked Sidewalk","I tried calling, thinking it would be faster, but there are no relevant reporting options on the menu. This car keeps parking on the sidewalk instead of pulling into their private driveway. 501 s rogers but the driveway entrance is on howe.",,"544–598 S Rogers St",Bloomington,IN,,39.16181564331055,-86.53878021240234
155174,"2016-08-24 15:03:41","2016-09-11 22:02:05","2016-08-24 15:57:51",closed,Other,"Blocked Sidewalk","There's now another vehicle parked on the sidewalk on the howe side of 501 s rogers (i walk by here a few times a day)","Planning and Transportation",,Bloomington,IN,,,
155239,"2016-08-29 11:55:36","2016-10-14 14:08:11","2016-10-14 14:08:11",closed,Other,"Blocked Sidewalk","New tenants have been parking too close to street on driveway so that they are blocking the sidewalk.",,"401 E Cottage Grove AVE",Bloomington,IN,47408,39.17282485961914,-86.52959442138672
155245,"2016-08-29 15:46:30","2016-09-11 22:02:05","2016-08-30 13:49:15",closed,Other,"Blocked Sidewalk","I very suddenly had to walk out in the road, afraid of drivers not seeing me, because of this construction. There's no warning leading up to it that the sidewalk is closed. And there's no sidewalk on the other side of the street so turning around and crossing wasn't an option. Southwest side of 2nd & Patterson 3:45pm","Planning and Transportation","1209 W 2nd ST",Bloomington,IN,47403,39.16055679321289,-86.54878997802734
155398,"2016-09-03 13:54:38","2016-09-12 00:00:00","2016-09-12 00:00:00",closed,Other,"Blocked Sidewalk","Tree blocking entire sidewalk on north side of Grimes. I might have placed it in wrong block, but it is mid-block.","Street Department","707 E Grimes LN",Bloomington,IN,47401,39.15342330932617,-86.52539062500000
155399,"2016-09-03 13:56:31","2019-01-10 08:51:31","2016-10-19 11:42:31",closed,Other,"Blocked Sidewalk","small tree/bush blocking sidewalk. Appears to be in front of no one's property.",,"1210-1298 South Henderson Street",Bloomington,IN,,39.15252304077148,-86.52700042724610
155499,"2016-09-06 09:01:00","2016-09-12 00:00:00","2016-09-12 00:00:00",closed,Other,"Blocked Sidewalk","suv parked on sidewalk. 302 east 7th street.",,,Bloomington,IN,,,
155610,"2016-09-08 20:23:41","2019-01-10 08:51:31","2017-01-31 09:45:45",closed,Other,"Blocked Sidewalk","North side of E Thornton Drove, between Bluffstone Ct and Greystone act. Sidewalk is obstructed by overgrown vegetation.",,,Bloomington,IN,,,
155959,"2016-09-16 10:18:24","2019-01-10 08:51:31","2016-10-06 10:08:11",closed,Other,"Blocked Sidewalk","Pedestrians will be hit in the face if they walk on this sidewalk on Atwater. The house the trees belong to, however, is at 401 Swain.",,,Bloomington,IN,,,
155965,"2016-09-16 14:08:04","2019-01-10 08:51:31","2017-01-31 09:44:36",closed,Other,"Blocked Sidewalk","Not sure if it's 2705 or 2708 Redwood Circle, but the sidewalk is COMPLETELY obscured and there is now a path worn through the grass from everyone trying to get through.
.",,"2705 Redwood Circle East",Bloomington,IN,,39.13647079467773,-86.49990844726562
155967,"2016-09-16 14:19:23","2019-01-10 08:51:31","2016-10-06 10:06:43",closed,Other,"Blocked Sidewalk","The address is 3401 Ashwood Dr.  The bushes are so overgrown that they are completely covering the sidewalk and have caused it to fall apart.",,"3225 S Coppertree DR",Bloomington,IN,47401,39.13325119018555,-86.50483703613281
155977,"2016-09-18 01:45:19","2019-01-10 08:51:31","2016-10-05 11:35:25",closed,Other,"Blocked Sidewalk","Sidewalk on north side of 2nd St blocked  by tree / bush. 20 yds west of Fess",,,Bloomington,IN,,,
155978,"2016-09-18 09:41:57","2019-01-10 08:51:31","2016-10-05 11:34:38",closed,Other,"Blocked Sidewalk","Overhang. Woodlawn above 2 d street",,,Bloomington,IN,,,
155979,"2016-09-18 09:43:05","2019-01-10 08:51:31","2016-10-05 11:33:02",closed,Other,"Blocked Sidewalk","Overhang. Hunter west of woodlawn.",,,Bloomington,IN,,,
155980,"2016-09-18 09:54:24","2019-01-10 08:51:31","2016-10-05 11:32:20",closed,Other,"Blocked Sidewalk","Overhang. Little Tibet restaurant. 4th at west of Dunn. Met with owner 9.20.16 he said he would trim this week.",,,Bloomington,IN,,,
155981,"2016-09-18 09:56:40","2019-01-10 08:51:31","2016-10-05 11:31:17",closed,Other,"Blocked Sidewalk","Blocked. Corner Lincoln and 4th.
Notified U Methodist Church that blue spruce will need to be trimmed or removed. 9.19.16",,,Bloomington,IN,,,
156084,"2016-09-20 11:16:23","2016-09-23 10:55:33","2016-09-23 10:55:33",closed,Other,"Blocked Sidewalk","There is a Jeep intruding on the sidewalk here near the corner of Atwater and Jordan. Sidewalk is already very narrow as it is.",,"402 S Jordan AVE",Bloomington,IN,47401,39.16300201416016,-86.51666259765625
156175,"2016-09-25 12:02:33","2016-09-27 13:43:06","2016-09-27 13:43:06",closed,Other,"Blocked Sidewalk","Damaged sign. University and woodlawn.","Street Department",,Bloomington,IN,,,
156287,"2016-09-29 11:28:45","2016-11-15 10:55:43","2016-11-15 10:55:43",closed,Other,"Blocked Sidewalk","Junk in yard as a ""yard sale"" blocking sidewalk","Planning and Transportation","2615 S Rockport RD",Bloomington,IN,47403,39.13897323608398,-86.54581451416016
156303,"2016-10-01 11:52:11","2016-10-06 14:30:27","2016-10-06 14:30:27",closed,Other,"Blocked Sidewalk","9th east of Fairview","Street Department",,Bloomington,IN,,,
156304,"2016-10-01 11:53:10","2019-01-10 08:51:31","2016-10-19 11:41:32",closed,Other,"Blocked Sidewalk","9th and Jackson",,,Bloomington,IN,,,
156305,"2016-10-01 11:54:05","2016-10-20 12:47:07","2016-10-20 12:47:07",closed,Other,"Blocked Sidewalk","Jackson s of 9th","Street Department",,Bloomington,IN,,,
156307,"2016-10-01 21:31:22","2016-10-14 14:06:37","2016-10-14 14:06:37",closed,Other,"Blocked Sidewalk","Sidewalk on east side of Rogers between 3rd and 4th, in front of outlet store, is often blocked by cars. Customers park on the sidewalk, meaning pedestrians have to walk on the busy street or cross the street.",,,Bloomington,IN,,,
156310,"2016-10-03 08:13:46","2016-10-24 13:49:51","2016-10-24 13:49:51",closed,Other,"Blocked Sidewalk","The construction crew working on the new building across from Kroger constantly blocks the multi-use path. The license plate of the truck blocking the path this morning is TK 990LMG.","Police Department","1116 S College Mall RD",Bloomington,IN,47401,39.15361785888672,-86.49790191650390
156409,"2016-10-06 10:42:13","2019-01-10 08:51:31","2017-01-31 09:43:59",closed,Other,"Blocked Sidewalk","Bushes grown across sidewalk....  again",,"2107 W 3rd St",Bloomington,IN,,39.15994262695312,-86.56814575195312
156410,"2016-10-06 10:49:24","2019-01-10 08:51:31","2017-01-31 09:43:31",closed,Other,"Blocked Sidewalk","Sidewalk blocked by brush blocking access to crossing street at ramp.  Entire west side of street has been unmaintained all of 2016",,"600–628 S Basswood Dr",Bloomington,IN,,39.15570449829102,-86.57228088378906
156430,"2016-10-07 10:04:41","2016-10-13 16:40:14","2016-10-13 16:40:13",closed,Other,"Blocked Sidewalk","Tenants are leaving large trash containers on the sidewalk, blocking pedestrian traffic.",HAND,"805 N Lincoln ST",Bloomington,IN,47408,39.17404937744141,-86.53124237060547
156445,"2016-10-08 13:15:39","2016-10-19 10:04:53","2016-10-19 10:04:53",closed,Other,"Blocked Sidewalk","Dangerous!!  On Atwater east of Henderson.","Street Department",,Bloomington,IN,,,
156446,"2016-10-08 13:20:08","2016-10-20 12:49:18","2016-10-20 12:49:18",closed,Other,"Blocked Sidewalk","Fess below Hunter.","Street Department",,Bloomington,IN,,,
156508,"2016-10-11 16:59:06","2016-11-15 10:54:17","2016-11-15 10:54:17",closed,Other,"Blocked Sidewalk","Sidewalk is blocked by limestone blocks.  Potential tripping hazard.","Planning and Transportation","1427 South Washington Street",Bloomington,IN,,39.15071105957031,-86.53247070312500
156552,"2016-10-13 10:39:13","2016-10-20 09:00:07","2016-10-20 09:00:07",closed,Other,"Blocked Sidewalk","not as much junk, but still blocking sidewalk, and who wants to buy this ""yard sale"" stuff that's left out in all weather","Planning and Transportation",,Bloomington,IN,,39.13902664184570,-86.54579162597656
156553,"2016-10-13 10:39:28","2016-10-20 08:59:46","2016-10-20 08:59:46",closed,Other,"Blocked Sidewalk","not as much junk, but still blocking sidewalk, and who wants to buy this ""yard sale"" stuff that's left out in all weather","Planning and Transportation",,Bloomington,IN,,39.13902664184570,-86.54579162597656
156554,"2016-10-13 10:40:52","2016-10-20 08:59:31","2016-10-20 08:59:31",closed,Other,"Blocked Sidewalk","not as much junk, but still blocking sidewalk, and who wants to buy this ""yard sale"" stuff that's left out in all weather","Planning and Transportation",,Bloomington,IN,,39.13908767700195,-86.54590606689453
156754,"2016-10-25 10:53:47","2017-01-23 11:50:31","2017-01-23 11:50:31",closed,Other,"Blocked Sidewalk","Sidewalk E of Skyline Dr on N Kinser Pk is overgrown (photo) and one section is sunken down over storm drain running across Kinser further East of the photo. This makes safely navigating this sidewalk in my power wheel very difficult.","Street Department",,Bloomington,IN,,,
156837,"2016-10-31 16:11:40","2016-11-04 13:14:27","2016-11-04 13:14:27",closed,Other,"Blocked Sidewalk","I tried and  tried to get the ""location"" to 2238 S Sweetbriar circle, but it kept saying 2227, not 2238.  Anyway, the locust trees in the tree plot in front of my house have limbs growing toward the ground.  I have to practically get on my knees when mowing to get under one of them.  Many of the trees in this addition have limbs very low to the ground, sidewalks, streets, or peoples' yards and need some trimming.","Planning and Transportation","2227 S Sweetbriar CIR",Bloomington,IN,47401,39.14107513427734,-86.52618408203125
156883,"2016-11-01 16:08:45","2016-11-02 09:22:06","2016-11-02 09:22:06",closed,Other,"Blocked Sidewalk","Construction on East side of Morton walk-around has no provision for wheelchairs forcing me to roll in the motorway risking collision with passing/overtaking motorists.","Planning and Transportation",,Bloomington,IN,,,
156884,"2016-11-01 16:43:35","2019-01-10 08:51:31","2017-01-31 09:43:01",closed,Other,"Blocked Sidewalk","Sidewalk in front of 2621 N Kinser Pk is overgrown with ground cover and is covered in dead pine needles forcing power chair operation close to curb of motorway. Very unsafe.",,,Bloomington,IN,,,
156885,"2016-11-01 16:48:02","2019-01-10 08:51:31","2017-01-19 14:28:10",closed,Other,"Blocked Sidewalk","Gravel driveway at 2721 N Kinser Pike covering sidewalk make for difficult going in my power chair.",,,Bloomington,IN,,,
157065,"2016-11-14 11:35:12","2017-01-11 06:46:19","2017-01-11 06:46:19",closed,Other,"Blocked Sidewalk","Abandoned construction signs in sidewalk near 17th&monroe&arlington roundabout","Planning and Transportation","1136 W 17th ST",Bloomington,IN,47404,39.17913436889648,-86.54745483398438
157265,"2016-11-25 17:51:03","2017-10-06 14:25:08","2017-10-06 14:25:08",closed,Other,"Blocked Sidewalk","large tree limb fallen on sidewalk and street","Street Department","317-319 South Jordan Avenue",Bloomington,IN,,39.16373825073242,-86.51638793945312
157308,"2016-12-02 09:18:24","2016-12-05 15:51:41","2016-12-05 15:51:41",closed,Other,"Blocked Sidewalk","There was a private tree cutting crew redirecting traffic until after 9:0 last night, and they left this massive tree blocking the sidewalk. It is making it unsafe for kids to walk to Harmony School.","Planning and Transportation","903 E 2nd ST",Bloomington,IN,47401,39.16114807128906,-86.52233886718750
157386,"2016-12-09 12:36:00","2019-07-02 09:50:15","2017-01-19 14:17:41",closed,Other,"Blocked Sidewalk","partially felled tree (and unchecked planting) is taking up half the sidewalk in front of 620 S. Park Ave",,,Bloomington,IN,,,
157748,"2017-01-17 10:08:58","2017-01-25 07:17:56","2017-01-25 07:17:56",closed,Other,"Blocked Sidewalk","Sidewalk impassible in front of old water treatment plant on S Walnut across from Royal (west side of street.","Street Department","300 W Gordon PIKE",Bloomington,IN,47403,39.12762451171875,-86.53146362304688
157785,"2017-01-19 09:51:09","2017-01-19 10:24:42","2017-01-19 10:24:42",closed,Other,"Blocked Sidewalk","A tree has fallen over a fence and is blocking the sidewalk. Sare Road close to Cathcart Street.","Street Department","2672-2676 E Cathcart St",Bloomington,IN,,39.14847946166992,-86.49937438964844
157807,"2017-01-20 12:09:50","2017-01-24 12:53:06","2017-01-24 12:53:06",closed,Other,"Blocked Sidewalk","Large garbage containers regularly stored on sidewalk 24/7, blocking pedestrian traffic.",HAND,"805 N Lincoln ST",Bloomington,IN,47408,39.17401885986328,-86.53127288818360
157970,"2017-02-01 12:05:32","2017-02-01 12:28:21","2017-02-01 12:28:21",closed,Other,"Blocked Sidewalk","Corner of 11th and Maple someone is running a auto parts business out of an apartment. Name is written on the doors and window. Sidewalk has had engines on it all week blocking the entire sidewalk.","Planning and Transportation","800 W 11th ST",Bloomington,IN,47404,39.17330932617188,-86.54225158691406
157977,"2017-02-02 10:25:15","2017-02-07 16:56:41","2017-02-07 16:56:41",closed,Other,"Blocked Sidewalk","Large trash container full of garbage has been sitting on the sidewalk for two weeks, blocking pedestrian traffic.",HAND,"803 N Lincoln ST",Bloomington,IN,47408,39.17380142211914,-86.53122711181640
158051,"2017-02-08 09:59:25","2017-03-30 14:14:22","2017-03-30 14:14:22",closed,Other,"Blocked Sidewalk","Cars are always on the sidewalk here. The blue one has space to pull forward but the rest have to park on the sidewalk because Hoosier workwear has concrete blocks forcing cars onto sidewalk. One must walk in the street to get around. I've reported this at least three times before and nothing has ever been done.","Planning and Transportation","201–299 S Rogers St",Bloomington,IN,,39.16498565673828,-86.53861236572266
158119,"2017-02-14 15:04:38","2017-05-04 10:28:38","2017-05-04 10:28:38",closed,Other,"Blocked Sidewalk","Can someone do something about the sidewalk parking at rogers and 4th/3rd?","Planning and Transportation","201–299 S Rogers St",Bloomington,IN,,39.16503143310547,-86.53868103027344
158186,"2017-02-20 12:04:40","2017-03-30 14:11:34","2017-03-30 14:11:34",closed,Other,"Blocked Sidewalk","717 N Grant. Rock has fallen from wall blocking sidewalk. Also, a moderate amount of trash in the yard. Thank you.","Planning and Transportation","700–798 N Grant St",Bloomington,IN,,39.17319488525391,-86.52973937988281
158199,"2017-02-21 13:11:07","2017-03-28 13:36:59","2017-03-28 13:36:59",closed,,"Blocked Sidewalk","Old boarding house at 624 S Fess uses its backyard on University for parking. Because there are no tire stops motorists often encroach on the sidewalk when they park their cars.","Planning and Transportation","624 S Fess AVE",Bloomington,IN,47401,39.16047668457031,-86.52619171142578
158352,"2017-03-06 08:35:53","2017-03-06 12:49:50","2017-03-06 12:49:50",closed,Other,"Blocked Sidewalk","Car partially on sidewalk at 223 S Maple","Parking Enforcement",,Bloomington,IN,,,
158602,"2017-03-31 14:33:15","2017-04-03 08:21:42","2017-04-03 08:21:42",closed,Other,"Blocked Sidewalk","Car has been parked for days blocking sidewalk.","Parking Enforcement","1771 S Henderson ST",Bloomington,IN,47401,39.14815139770508,-86.52684783935547
158654,"2017-04-05 12:44:07","2017-04-11 14:10:54","2017-04-11 14:10:54",closed,Other,"Blocked Sidewalk","Sign abandoned after cbu construction acouple weeks ago at 11th & college is blocking sidewalk on south side of 11th just west of college","Planning and Transportation","267 W 11th ST",Bloomington,IN,47404,39.17323684692383,-86.53502655029297
158721,"2017-04-12 12:29:56","2017-04-18 08:28:26","2017-04-18 08:28:25",closed,Other,"Blocked Sidewalk","The old Bloomington bagel co building has a construction site that has been blocking the sidewalk for weeks...i beams, concrete trucks, saw horses in front of the entrance of 420.  Not even trying to keep it open.","Planning and Transportation","151-199 North Dunn Street",Bloomington,IN,,39.16720581054688,-86.52828979492188
158745,"2017-04-13 10:32:52","2019-01-10 08:51:31","2017-04-18 11:16:58",closed,Other,"Blocked Sidewalk","There is always a lot of gravel here. That's not good for bicycles. Can it be removed? Btw, the last time I asked INDOT about cleaning up gravel on the 45/46 multi-use path, they said I should ask the city.",,"Indiana University Bloomington",Bloomington,IN,,39.18607330322266,-86.52098846435547
158753,"2017-04-13 17:56:46","2019-01-10 08:51:31","2017-04-18 11:16:11",closed,Other,"Blocked Sidewalk","Another instance like case #158745.",,"611 E Matlock RD",Bloomington,IN,47408,39.18642044067383,-86.52693176269531
158760,"2017-04-14 17:40:11","2017-04-18 08:29:00","2017-04-18 08:28:59",closed,Other,"Blocked Sidewalk","This vehicle is frequently parked on the sidewalk.","Parking Enforcement","3629–3675 E Grandview Dr",Bloomington,IN,,39.16893386840820,-86.48230743408203
158827,"2017-04-19 16:53:51","2019-01-10 08:51:31","2017-10-11 11:35:39",closed,Other,"Blocked Sidewalk","tree branches and planting are covering/impacting over half of the sidewalk in front of 620 S. Park Avenue. It's been a problem for over four months. There was a big dead dangling tree branch (which has been removed) but the rest of the tree and the ground cover has taken over the sidewalk.",,,Bloomington,IN,,,
158934,"2017-04-28 11:22:22","2019-01-10 08:51:31","2017-10-11 11:35:13",closed,Other,"Blocked Sidewalk","This property has trees/shrubbery taking over up to 75% of the sidewalk. Yesterday I watched an elderly woman try to navigate past it and it was very difficult for her.",,"114-198 East 1st Street",Bloomington,IN,,39.15932846069336,-86.53252410888672
159113,"2017-05-15 16:47:14","2017-05-17 06:11:04","2017-05-17 06:11:04",closed,Other,"Blocked Sidewalk","I live in Canterbury house apartments and use the Bloomington Transit to get around. My daughter (26) and myself are both disabled and have mobility limitations. I would assume that it was from last Wednesday's storms, but there is a large tree branch blocking the sidewalk along basswood between the entrance to Canterbury House Apartments and the bus stop at Forest Ridge Apartments. We had a doctor's appointment this morning and had to be at the bus stop by 7:20AM and was surprised to see such a mess blocking the sidewalk. Since my daughter would be unable step off the sidewalk with her rollater walker to avoid the section that the tree branch covers it meant we had to walk from Canterbury House Apartments entrance to the entrance to Forest Ridge on the road. This was very unsettling for both her and I because we both know how bad cars fly around the corner and how fast they speed through this section. We came in from the bus at 2:25pm today and the tree branch was still there so we took a photo to show.","Street Department","540 S Basswood DR",Bloomington,IN,47403,39.15814208984375,-86.57086181640625
159159,"2017-05-19 18:20:29","2017-05-22 11:32:16","2017-05-22 11:32:16",closed,Other,"Blocked Sidewalk","This large tree (picture attached) fell on the Jackson Creek
paved trail (located south of Creeks Edge Dr) some 
three weeks ago.  I'm not sure whether this tree's
removal is the responsibility of the city?  Thank you
for your kind assistance!","Parks and Recreation","Creeks Edge Path",Bloomington,IN,,39.12844085693359,-86.49816131591797
159162,"2017-05-21 20:58:32","2019-01-10 08:51:31","2017-10-11 11:34:50",closed,Other,"Blocked Sidewalk","Vegetation obstructing sidewalk",,"816 E University ST",Bloomington,IN,47401,39.16032409667969,-86.52330017089844
159171,"2017-05-22 17:37:13","2019-01-10 08:51:31","2017-10-11 11:40:25",closed,Other,"Blocked Sidewalk","Vegetation by driveway obstructs sidewalk",,"109 E 1st ST",Bloomington,IN,47401,39.15939712524414,-86.53308105468750
159172,"2017-05-22 17:39:02","2019-01-10 08:51:31","2017-10-11 11:39:56",closed,Other,"Blocked Sidewalk","Vegetation near driveway obstructed sidewalk",,"114 E 1st ST",Bloomington,IN,47401,39.15930175781250,-86.53260803222656
159203,"2017-05-25 07:09:10","2019-01-10 08:51:31","2017-10-11 11:39:22",closed,Other,"Blocked Sidewalk","Branches hanging over sidewalk.",,"1523–1535 S Sare Rd",Bloomington,IN,,39.15028762817383,-86.49826812744140
159219,"2017-05-26 12:02:42","2019-01-10 08:51:31","2017-06-01 13:15:45",closed,Other,"Blocked Sidewalk","They're blocking the sidewalk detour on the west side of Dunn at the bbc construction site again.",,"111 N Dunn ST",Bloomington,IN,47408,39.16690063476562,-86.52828216552734
159230,"2017-05-26 20:48:14","2017-05-30 13:31:42","2017-05-30 13:31:42",closed,Other,"Blocked Sidewalk","Overhanging branch and downed branch block sidewalk","Street Department","South Weatherstone Lane",Bloomington,IN,,39.15412139892578,-86.52153015136719
159233,"2017-05-28 11:06:33","2019-01-10 08:51:31","2017-10-11 11:38:54",closed,Other,"Blocked Sidewalk","Tree branches overhanging sidewalk (~3' clearance) along North Smith at Yorktown Apartments.",,"215 N Smith Rd",Bloomington,IN,,39.16681671142578,-86.48135375976562
159414,"2017-05-31 11:24:09","2019-01-10 08:51:31","2017-06-01 13:12:57",closed,Other,"Blocked Sidewalk","Bbc building construction is still blocking west sidewalk on dunn w multiple pieces of heavy equipment and vans",,"151-199 North Dunn Street",Bloomington,IN,,39.16728973388672,-86.52827453613281
159459,"2017-06-02 11:16:43","2017-10-11 10:45:21","2017-10-11 10:45:20",closed,Other,"Blocked Sidewalk","Thursday, the bbc construction site was not blocking the west sidewalk on dunn for the first time in weeks. Friday, they are blocking it again","Planning and Transportation","111 N Dunn ST",Bloomington,IN,47408,39.16688919067383,-86.52828216552734
159460,"2017-06-02 13:07:55","2017-08-28 13:42:19","2017-08-28 13:42:19",closed,Other,"Blocked Sidewalk","Sidewalk closed for construction with no alternative. mutcd 6d-1 ""pedestrians should be provided with safe, convenient travel path that replicates as nearly as possible the most desirable characteristics of sidewalks"".  On college, the most desirable characteristic is not crossing college!!!!!  This is the context where a quality detour is *more* important than in more walkable settings, but staff has mistakenly determined the exact opposite.","Planning and Transportation","201-249 West 8th Street",Bloomington,IN,,39.16947174072266,-86.53489685058594
159474,"2017-06-04 17:43:08","2019-01-10 08:51:31","2017-10-11 11:38:23",closed,Other,"Blocked Sidewalk","Between 808 and apartment building. Vegetation obstructing sidewalk",,"808 S Stull AVE",Bloomington,IN,47401,39.15863800048828,-86.52491760253906
159524,"2017-06-06 14:47:12","2019-01-10 08:51:31","2017-10-11 11:34:18",closed,Other,"Blocked Sidewalk","Crabapple tree branches have grown over and down onto the sidewalk in front of the home at 1700 E. Camby Lane. Residents are unable to walk on the sidewalk beneath / next to the tree, and must move into the roadway.",,"1700 E Camby LN",Bloomington,IN,47401,39.13552093505859,-86.51186370849610
159526,"2017-06-06 14:54:16","2017-06-06 15:12:19","2017-06-06 15:12:18",closed,Other,"Blocked Sidewalk","Large shrubs along the Abby Lane side of the 1700 E. Camby Lane property are growing out into the sidewalk area. These impede the line of sight for cars exiting Camby onto Abby (right or left) and also force walkers to move into the street when walking on the east side of Abby Lane. The shrubs are so large that if walkers squeeze in to walk next to them on the sidewalk, it's uncomfortable to do so because they could easily conceal humans or wild animals and are therefore intimidating, especially during evenings and nights.","Planning and Transportation","3101-3199 South Abby Lane",Bloomington,IN,,39.13544845581055,-86.51198577880860
