ticket_id,enteredDate,lastModified,closedDate,status,contactMethod,category,description,department,location,city,state,zip,latitude,longitude
159527,"2017-06-06 14:55:18","2017-06-06 15:13:03","2017-06-06 15:13:02",closed,Other,"Blocked Sidewalk","Large shrubs along the Abby Lane side of the 1700 E. Camby Lane property are growing out into the sidewalk area. These impede the line of sight for cars exiting Camby onto Abby (right or left) and also force walkers to move into the street when walking on the east side of Abby Lane. The shrubs are so large that if walkers squeeze in to walk next to them on the sidewalk, it's uncomfortable to do so because they could easily conceal humans or wild animals and are therefore intimidating, especially during evenings and nights.","Planning and Transportation","3101-3199 South Abby Lane",Bloomington,IN,,39.13544845581055,-86.51198577880860
159596,"2017-06-09 19:54:39","2017-07-12 08:55:01","2017-07-12 08:55:01",closed,Other,"Blocked Sidewalk","Vegetation obstructing sidewalk near driveway","Planning and Transportation","813-815 East University Street",Bloomington,IN,,39.16051483154297,-86.52326965332031
159600,"2017-06-10 13:32:16","2017-07-06 16:33:28","2017-07-06 16:33:28",closed,Other,"Blocked Sidewalk","Overgrowth of vegetation prevents use of the sidewalk.","Planning and Transportation","1741 S Park AVE",Bloomington,IN,47401,39.14764022827148,-86.52426910400390
159618,"2017-06-12 12:41:33","2017-10-11 10:48:19","2017-10-11 10:48:19",closed,Other,"Blocked Sidewalk","Lo, a giant forklift is still/again parked in sidewalk detour at bbc site","Planning and Transportation","111 N Dunn ST",Bloomington,IN,47408,39.16687393188477,-86.52831268310547
159634,"2017-06-12 14:32:58","2017-06-19 14:29:25","2017-06-19 14:29:24",closed,Other,"Blocked Sidewalk","City van completely blocking sidewalk","Police Department","513 W 4th St",Bloomington,IN,,39.16559600830078,-86.53900909423828
159719,"2017-06-17 22:09:39","2017-07-06 16:44:18","2017-07-06 16:44:18",closed,Other,"Blocked Sidewalk","tree over sidewalk","Planning and Transportation","2405-2553 East Rogers Road",Bloomington,IN,,39.13600921630859,-86.49968719482422
159740,"2017-06-19 10:52:52","2019-01-10 08:51:31","2017-10-11 11:32:11",closed,Other,"Blocked Sidewalk","Overgrown bush in front of 408 S. High makes sidewalk unusable.",,,Bloomington,IN,,,
159747,"2017-06-19 16:46:55","2017-06-21 14:07:21","2017-06-21 14:07:21",closed,Other,"Blocked Sidewalk","This multi-use path has trees blocking it.  I reported this last year on 6/23/2016 to Parks & Rec and I kept getting referred to different departments with the final message on 12/6/2016 saying it was up to the street department.  Even so, this path is still blocked.  I hope you are the correct department and can help this time.","Street Department","1099-1469 East Winslow Road",Bloomington,IN,,39.13613510131836,-86.51447296142578
159785,"2017-06-20 12:17:36","2017-06-20 13:40:48","2017-06-20 13:40:48",closed,Other,"Blocked Sidewalk","East Kirkwood Avenue looks like a shanty town!  Homeless are blocking the street, sleeping on the sidewalk, hanging clothes from fences and putting up tents!","Police Department",,Bloomington,IN,,,
159860,"2017-06-26 13:25:19","2019-01-10 08:51:31","2017-10-11 11:31:08",closed,Other,"Blocked Sidewalk","Vegetation blocks sidewalk",,"606 S Park AVE",Bloomington,IN,47401,39.16110610961914,-86.52401733398438
159940,"2017-06-29 18:24:32","2017-08-14 08:30:07","2017-08-14 08:30:07",closed,Other,"Blocked Sidewalk","Dumpster obstructs sidewalk","Planning and Transportation","400-404 South Fess Avenue",Bloomington,IN,,39.16286849975586,-86.52594757080078
159981,"2017-07-04 10:48:58","2019-01-10 08:51:31","2017-10-11 11:28:52",closed,Other,"Blocked Sidewalk","Bush over sidewalk",,"1386–1450 S College Mall Rd",Bloomington,IN,,39.15140914916992,-86.49771881103516
160006,"2017-07-05 22:07:55","2019-01-10 08:51:31","2017-10-11 11:28:20",closed,Other,"Blocked Sidewalk","The sidewalk on the west side of the street along Basswood Drive has multiple low hanging trees and bushes blocking the path from being used. It is particularly bad between the two Forest Ridge complexes, and can get bad on the east side of the street as well. Thank you.",,"868 S Basswood DR",Bloomington,IN,47403,39.15666961669922,-86.57119750976562
160039,"2017-07-07 17:38:20","2019-01-10 08:51:31","2017-10-10 11:54:10",closed,Other,"Blocked Sidewalk","Tree limbs hanging low, blocking sidewalk.",,"410-424 South Jordan Avenue",Bloomington,IN,,39.16249084472656,-86.51639556884766
160040,"2017-07-07 18:05:47","2017-07-13 15:33:19","2017-07-13 15:33:18",closed,Other,"Blocked Sidewalk","Hobo setting off fireworks. Drinking beer. Blocking sidewalk. 6th walnut.","Police Department","200 N Walnut ST",Bloomington,IN,47408,39.16764450073242,-86.53346252441406
160068,"2017-07-10 17:58:46","2018-05-11 15:59:15","2018-05-11 15:59:15",closed,Other,"Blocked Sidewalk","Bamboo has overgrown sidewalk at 1000 Wednesday 6th St.","Planning and Transportation",,Bloomington,IN,,,
160094,"2017-07-12 10:58:25","2017-08-22 11:30:35","2017-08-22 11:30:35",closed,Other,"Blocked Sidewalk","Large city tree branch down on sidewalk and yard and rotted.","Parks and Recreation","2810 E David DR",Bloomington,IN,47401,39.13824844360352,-86.49580383300781
160145,"2017-07-17 19:43:58","2019-01-10 08:51:31","2017-07-19 15:12:39",closed,Other,"Blocked Sidewalk","It is getting increasingly difficult to pass here. I've seen runners step into the street to get around it. Cyclists have to stop.",,"1452–1498 S College Mall Rd",Bloomington,IN,,39.15072250366211,-86.49835205078125
160186,"2017-07-19 20:05:07","2017-10-11 12:15:51",,open,Other,"Blocked Sidewalk","Vegetation blocks north side sidewalk on 8th between College and Walnut.","Planning and Transportation","100-198 West 8th Street",Bloomington,IN,,39.16954421997070,-86.53397369384766
160200,"2017-07-20 20:53:15","2019-01-10 08:51:31","2017-10-11 11:37:07",closed,Other,"Blocked Sidewalk","Sidewalk obstruction at corner due to weeds. Also lawn has high Weeds",,"918-998 East 1st Street",Bloomington,IN,,39.15930175781250,-86.52273559570312
160201,"2017-07-20 21:15:50","2017-10-11 12:15:22",,open,Other,"Blocked Sidewalk","Vegetation blocks sidewalk","Planning and Transportation","900-902 South Lincoln Street",Bloomington,IN,,39.15632247924805,-86.53138732910156
160202,"2017-07-20 21:17:39","2017-10-11 12:14:53",,open,Other,"Blocked Sidewalk","Vegetation blocks sidewalk between the houses","Planning and Transportation","812-816 South Lincoln Street",Bloomington,IN,,39.15668106079102,-86.53137969970703
160203,"2017-07-20 21:21:10","2019-01-10 08:51:31","2017-10-10 11:40:45",closed,Other,"Blocked Sidewalk","Vegetation blocks sidewalk just south of alley",,"618 S Lincoln ST",Bloomington,IN,47401,39.15871047973633,-86.53138732910156
160212,"2017-07-22 09:19:23","2017-11-08 15:35:51","2017-11-08 15:35:51",closed,Other,"Blocked Sidewalk","Between Grimes and Driscoll on Lincoln","Planning and Transportation","1208 S Lincoln ST",Bloomington,IN,47401,39.15294265747070,-86.53137969970703
160220,"2017-07-23 21:12:28","2017-07-27 15:56:16","2017-07-27 15:56:16",closed,Other,"Blocked Sidewalk","They have a large trampoline in their front yard that is on the public sidewalk.","Planning and Transportation","904 S Larkspur LN",Bloomington,IN,47403,39.15675735473633,-86.54766082763672
160563,"2017-08-09 15:10:35","2017-08-23 11:18:30",,open,Other,"Blocked Sidewalk","Sidewalk is pretty much completely blocked by vegetation.  Students use that sidewalk to reach the bus stops and are forced to walk in the street.","Planning and Transportation","3538 S Wellington DR",Bloomington,IN,47401,39.13082122802734,-86.52515411376953
160569,"2017-08-10 09:30:00","2018-07-31 10:54:42","2018-07-31 10:54:42",closed,Other,"Blocked Sidewalk","this is often an issue in front of my office, with the road newly paved could you consider wheel stops to keep pedestrians right of way unblocked? thank you","Street Department","501 N College AVE",Bloomington,IN,47404,39.17060470581055,-86.53501129150390
160570,"2017-08-10 10:02:11","2017-08-23 11:13:41",,open,Other,"Blocked Sidewalk","818 e. First St, weeds obstructing sidewalk on first and Woodlawn","Planning and Transportation",,Bloomington,IN,,39.15924453735352,-86.52277374267578
160728,"2017-08-20 10:29:08","2018-02-08 10:56:41","2018-02-08 10:56:40",closed,Other,"Blocked Sidewalk","Over grown bushes","Planning and Transportation","1246 S Fenbrook LN",Bloomington,IN,47401,39.15339279174805,-86.48465728759766
160806,"2017-08-22 14:38:53","2017-08-31 14:36:30","2017-08-31 14:36:30",closed,Other,"Blocked Sidewalk","car blocks sidewalk","Parking Enforcement",,Bloomington,IN,,39.16213226318359,-86.51668548583984
160807,"2017-08-22 14:43:37","2017-10-11 10:41:02","2017-10-11 10:41:02",closed,Other,"Blocked Sidewalk","sidewalk block and part removed... been like this for months...","Planning and Transportation",,Bloomington,IN,,39.16151809692383,-86.51832580566406
160810,"2017-08-22 15:11:28","2017-09-05 12:01:42","2017-09-05 12:01:42",closed,Other,"Blocked Sidewalk","There is a PODS storage container that has been placed across the sidewalk at 310 N Lincoln St.","Planning and Transportation",,Bloomington,IN,,,
161100,"2017-09-11 13:06:52","2017-11-08 13:21:14","2017-11-08 13:21:14",closed,Other,"Blocked Sidewalk","There is an obstruction on College Ave. just before 3rd St. Does this obstruction still serve a purpose or could it be removed to make turning on that corner more safe?","Planning and Transportation","228-256 West 3rd Street",Bloomington,IN,,39.16472244262695,-86.53478240966797
161101,"2017-09-11 14:34:16","2017-09-11 14:35:32",,open,Other,"Blocked Sidewalk","A large portion of the sidewalk along the east side of High Street between Moore's Pike and Arden Place is overgrown. There are a couple spots that have poison ivy growing onto the walkway. Is the city responsible for clearing this? Can it please be maintained?","Planning and Transportation","1685-1799 South High Street",Bloomington,IN,,39.14894485473633,-86.50824737548828
161161,"2017-09-14 12:13:42","2017-09-15 12:16:44","2017-09-15 12:16:44",closed,Other,"Blocked Sidewalk","Sidewalk in front of 1700 E Camby Lane and to the west side of the property both blocked by tree branches / bushes overgrown.","Planning and Transportation","1700 E Camby LN",Bloomington,IN,47401,39.13544845581055,-86.51182556152344
161163,"2017-09-14 15:29:17","2017-11-08 15:43:54","2017-11-08 15:43:54",closed,Other,"Blocked Sidewalk","cars parked in lawn blocking sidewalk","Planning and Transportation","912 S Larkspur LN",Bloomington,IN,47403,39.15649414062500,-86.54788970947266
161165,"2017-09-14 17:32:48","2017-09-22 09:10:06","2017-09-22 09:10:06",closed,Other,"Blocked Sidewalk","1919 Southdowns is the home that has let the vegetation overgrow the public sidewalk, so that we have to walk on his neighbor's lawn : this sidewalk has lots of foot & bicycle traffic from schoolchildren + adult commuters.  Bushes need to be cut back very hard -- not just trimmed a little.  This is an on-going problem & homeowner does NOT trim.  Please help!","Planning and Transportation","1925-1929 East Southdowns Drive",Bloomington,IN,,39.15587234497070,-86.51047515869140
161169,"2017-09-15 10:16:14","2017-09-15 12:15:51","2017-09-15 12:15:51",closed,Other,"Blocked Sidewalk","Sidewalk in front of 1700 E Camby Ln blocked by low-hanging tree branches.","Planning and Transportation","1700-1706 East Camby Lane",Bloomington,IN,,39.13547897338867,-86.51176452636719
161187,"2017-09-18 09:57:56","2017-09-18 11:11:06","2017-09-18 11:11:06",closed,Other,"Blocked Sidewalk","The sidewalk fronting this property is blocked by low-hanging branches.","Planning and Transportation","1700 E Camby LN",Bloomington,IN,47401,39.13539505004883,-86.51184844970703
161228,"2017-09-19 11:20:58","2017-09-19 11:28:49","2017-09-19 11:28:49",closed,Other,"Blocked Sidewalk","There are tree branches hanging down onto the sidewalk in front of this address. Also the bushes around the side of the house are growing out over the sidewalk there as well.","Planning and Transportation","1700 E Camby LN",Bloomington,IN,47401,39.13542175292969,-86.51184844970703
161247,"2017-09-20 11:26:12","2017-09-20 12:20:00","2017-09-20 12:20:00",closed,Other,"Blocked Sidewalk","Tree branches overhanging sidewalk in front of house. Bushes growing out across sidewalk on side of house.","Planning and Transportation","1700 E Camby LN",Bloomington,IN,47401,39.13543319702148,-86.51186370849610
161260,"2017-09-21 09:42:22","2017-09-21 09:44:26","2017-09-21 09:44:26",closed,Other,"Blocked Sidewalk","Sidewalks blocked on front and side of 1700 E Camby by overgrown branches.","Planning and Transportation","1700 E Camby LN",Bloomington,IN,47401,39.13541412353516,-86.51185607910156
161275,"2017-09-22 12:32:23","2017-09-22 12:55:14","2017-09-22 12:55:14",closed,Other,"Blocked Sidewalk","Sidewalk blocked by branches.","Planning and Transportation","1700 E Camby LN",Bloomington,IN,47401,39.13544845581055,-86.51186370849610
161357,"2017-09-29 11:48:58","2017-10-03 11:39:12","2017-10-03 11:39:12",closed,Other,"Blocked Sidewalk","Firestone always has cars parked on the sidewalk along walnut st. They've actually painted blue parking stripes on the sidewalk.","Parking Enforcement",,Bloomington,IN,,39.16491317749023,-86.53354644775390
161405,"2017-10-03 16:51:33","2017-10-19 16:19:43","2017-10-19 16:19:43",closed,Other,"Blocked Sidewalk","N. Walnut approaching 17th. (10/2/17) Sidewalk blocked by multiple large trash cans. Forces wheelchair in either direction into one way bike lane.","Planning and Transportation",,Bloomington,IN,,,
161407,"2017-10-03 16:59:38","2017-10-05 09:48:10","2017-10-05 09:48:10",closed,Other,"Blocked Sidewalk","E 2nd street at CVS/Goodwill. Damaged siderail blocking sidewalk.","Street Department",,Bloomington,IN,,,
161408,"2017-10-03 17:00:56","2018-02-08 11:00:09","2018-02-08 11:00:09",closed,Other,"Blocked Sidewalk","E 3rd at Orange Leaf yoghurt shop. Overgrown hedge blocking sidewalk.","Planning and Transportation",,Bloomington,IN,,,
161471,"2017-10-06 14:34:09","2017-10-10 11:17:26","2017-10-10 11:17:26",closed,Other,"Blocked Sidewalk","Gravel covering sidewalk on 17th looking West toward College is a safety/navigation hazard for  power chair users. The photo was taken just below the alleyway behind Square Donuts.",,,Bloomington,IN,,,
161489,"2017-10-10 16:52:30","2017-11-21 14:23:32","2017-11-21 14:23:32",closed,Other,"Blocked Sidewalk","This curb is at the alleyway S of 1818 Apparel Co. on N College. It, and the next 5-6 sidewalk slabs South, represent the last obstacles to power wheelchairs using the sidewalk from Square Donuts to CVS. This trip has become increasingly important for me since my Rx's were transferred as part of the Marsh shutdown on N Kinser.","Street Department",,Bloomington,IN,,,
161541,"2017-10-12 12:43:05","2017-10-18 09:40:25","2017-10-18 09:40:25",closed,Other,"Blocked Sidewalk","Residents at 2526 S Rogers St Bloomington, In 47403 have at least 2 of their 4+ cars and trucks consistently parked fully on the sidewalk that borders their property on Ralston. They're essentially using this sidewalk as a parking lot / repair area for their vehicles. This is not a temporary occurrence but something that is observed on a daily basis for many months.","Parking Enforcement","2526 S Rogers ST",Bloomington,IN,47403,39.13853454589844,-86.53880310058594
161556,"2017-10-13 18:55:17","2018-05-11 16:01:14","2018-05-11 16:01:14",closed,Other,"Blocked Sidewalk","Sidewalk on Twin Oaks RDG is blocked by a pin oak tree.  The tree needs to be trimmed.  Sidewalk near same intersection W Pine Meadows is blocked by a large bush.  Children walking to Summit Elementary school are forced to walk in the street.","Planning and Transportation","1132-1144 West Twin Oaks Ridge",Bloomington,IN,,39.13970184326172,-86.55027770996094
161571,"2017-10-16 11:52:56","2019-07-25 12:50:39",,open,Other,"Blocked Sidewalk","Fallen tree
- Rogers, east of High Street 
-North side of street  
-East of the Jackson Creek creek","Parks and Recreation",,Bloomington,IN,,,
161579,"2017-10-16 14:32:25","2017-10-17 08:48:34","2017-10-17 08:48:34",closed,Other,"Blocked Sidewalk","I keep pointing out blocked sidewalks just north of downtown ice cream shops, and the city  keeps not fixing them.  It's a question of priorities i guess but i don't think the lube shop deserves to impinge on a sidewalk which is so vital to so many other businesses.  What do you have against the chocolate moose??","Parking Enforcement",,Bloomington,IN,,39.16472244262695,-86.53350067138672
161590,"2017-10-17 10:52:43","2017-10-17 10:53:39","2017-10-17 10:53:39",closed,Other,"Blocked Sidewalk","Cars parked on the sidewalk outside Firestone Auto.","Planning and Transportation","101-199 East 3rd Street",Bloomington,IN,,39.16473388671875,-86.53351593017578
161595,"2017-10-17 16:32:14","2017-10-18 07:38:05","2017-10-18 07:38:05",closed,Other,"Blocked Sidewalk","My neighbors have put a pop-up tent across the sidewalk. They've tied it to the light pole. It's been there for two days.",,"612–622 W Smith Ave",Bloomington,IN,,39.16286468505859,-86.54090118408203
161596,"2017-10-17 16:43:28","2017-10-30 12:54:40","2017-10-30 12:54:39",closed,Other,"Blocked Sidewalk","I just reported this, but the app wouldn't allow me to edit. The tent is actually tied to the fire hydrant.",,"351–499 S Fairview St",Bloomington,IN,,39.16279983520508,-86.54091644287110
161640,"2017-10-23 22:06:21","2017-10-24 07:49:13",,open,Other,"Blocked Sidewalk","Overgrown sidewalk","Planning and Transportation","1139 W Pine Meadows DR",Bloomington,IN,47403,39.13951492309570,-86.54984283447266
161707,"2017-10-30 13:13:45","2017-11-08 15:39:42","2017-11-08 15:39:42",closed,Other,"Blocked Sidewalk","The sidewalk on Moores Pk. between Bittnerwoods and Shadow Creek has a section that is impassable due to the grown of plants hanging over a dilapidated fence.  It will only become more dangerous as wet and icy weather approach.","Planning and Transportation",,Bloomington,IN,,,
161716,"2017-11-01 13:44:24","2017-11-01 13:58:05","2017-11-01 13:58:05",closed,Other,"Blocked Sidewalk","Blue Volkswagen frequently on walk","Parking Enforcement","500 N Prow AVE",Bloomington,IN,47408,39.17067718505859,-86.52890014648438
161781,"2017-11-08 16:42:57","2017-11-09 10:43:24","2017-11-09 10:43:24",closed,Other,"Blocked Sidewalk","Collapsed walk blocking my power wheelchair completely at corner of N Walnut and (name?)  S of the Hampton Inn. Required me to reverse, go back to the previous cut and run N in the 40mph motorway. Very hazardous condition for me, any unsafe for everybody.","Street Department",,Bloomington,IN,,,
161817,"2017-11-14 17:25:39","2018-06-18 12:52:54","2018-06-18 12:52:54",closed,Other,"Blocked Sidewalk","404 s. Fess dumpster obstructs sidewalk","Planning and Transportation",,Bloomington,IN,,39.16283416748047,-86.52606201171875
161842,"2017-11-17 14:20:25","2017-11-17 16:16:00","2017-11-17 16:16:00",closed,Other,"Blocked Sidewalk","The Firestone is still blocking the sidewalk.","Parking Enforcement",,Bloomington,IN,,39.16483306884766,-86.53350067138672
161843,"2017-11-17 14:26:43","2017-11-17 16:16:30","2017-11-17 16:16:30",closed,Other,"Blocked Sidewalk","Since i know you won't do anything about it, please indicate where the fucking sidewalk is supposed to be in this photo. It is like this every. Single. Time that i come by here during business hours","Parking Enforcement",,Bloomington,IN,,39.16477966308594,-86.53347778320312
161910,"2017-11-30 09:58:34","2017-11-30 10:18:51","2017-11-30 10:18:51",closed,Other,"Blocked Sidewalk","Contractor vehicles have been parking on the sidewalk in this location for several days now....please ticket","Parking Enforcement","501-511 South Euclid Avenue",Bloomington,IN,,39.16231536865234,-86.54335784912110
161930,"2017-12-02 10:08:10","2017-12-04 14:56:36","2017-12-04 14:56:36",closed,Other,"Blocked Sidewalk","There is no cut out to help those in wheel chairs. This should be an accessible sidewalk.","Street Department",,Bloomington,IN,,,
161943,"2017-12-04 19:55:32","2018-05-11 16:05:35","2018-05-11 16:05:35",closed,Other,"Blocked Sidewalk","There is a tree that has fallen down and part of it is sticking out onto the sidewalk","Planning and Transportation","1124 W 6th ST",Bloomington,IN,47404,39.16776657104492,-86.54792022705078
161948,"2017-12-05 10:26:05","2017-12-05 11:39:43","2017-12-05 11:39:43",closed,Other,"Blocked Sidewalk","I'm not sure which service to report this under, but Deer Park Management has not been sufficiently taking care of leaf removal at The Boulders apartment complex.  They hired a contractor, who just blew the leaves onto the curb/street/sidewalk, leaving some of the sidewalks covered in leaves (slippery when wet), and blocking storm drains in the street.  I also noticed on the leaf pickup map that our neighborhood was marked as complete, but if you were to drive through, you would see that this isn't the case (S. Weatherstone Lane).","Street Department",,Bloomington,IN,,,
162250,"2018-01-09 12:52:49","2018-01-09 13:21:15","2018-01-09 13:21:15",closed,Other,"Blocked Sidewalk","Two SUVs parked on sidewalk","Parking Enforcement","402-498 South Euclid Avenue",Bloomington,IN,,39.16268539428711,-86.54338836669922
162364,"2018-01-21 11:37:35","2019-07-29 17:08:44","2019-07-29 17:08:44",closed,Other,"Blocked Sidewalk","The walking/bike trail opposite the Ferguson Dog Park was NOT cleared of snow and we just observed a person pushing, with great difficulty, another person in a wheelchair on this snow/slush covered walk. Shouldn’t the City clear it’s walks just as it expects homeowners to do?","Parks and Recreation","3900-3978 North Old State Road 37",Bloomington,IN,,39.20724868774414,-86.53054046630860
162381,"2018-01-22 21:23:04","2018-02-09 09:29:23","2018-02-09 09:29:23",closed,Other,"Blocked Sidewalk","Trampoline blocking sidewalk",HAND,"904 S Larkspur LN",Bloomington,IN,47403,39.15674972534180,-86.54767608642578
163047,"2018-02-12 13:37:49","2018-02-12 17:17:09","2018-02-12 17:17:09",closed,Other,"Blocked Sidewalk","Sidewalk detour for construction on south side of Kirkwood between lincoln&washington is obstructed by concrere-pumping crane.","Planning and Transportation",,Bloomington,IN,,39.16651916503906,-86.53144836425781
163249,"2018-02-21 11:01:27","2018-04-16 06:33:33","2018-04-16 06:33:33",closed,Other,"Blocked Sidewalk","on walnut, between 3rd st and 4th st, in front of a law office (after firestone), there's a sunken-in sidewalk panel that floods when it rains, so then i have to walk around it in the mud. i have noticed this before, but this is the 1st time i am reporting it.","Street Department",,Bloomington,IN,,,
163273,"2018-02-22 15:59:42","2018-02-23 10:37:15","2018-02-23 10:37:15",closed,Other,"Blocked Sidewalk","construction detour on Kirkwood blocked again by cement truck","Planning and Transportation",,Bloomington,IN,,39.16658401489258,-86.53166198730469
163304,"2018-02-25 15:20:02","2018-11-20 10:14:23","2018-11-20 10:14:23",closed,Other,"Blocked Sidewalk","Occasionally, I find a vehicle parked on the bicycle/pedestrian path that leads from Countryside Lane to the apartment complex behind the houses on Countryside Lane and Adams Circle.  I often walk or cycle in this neighborhood and find it difficult to navigate the improperly parked vehicle, which usually blocks the cross sidewalk as well.

Would it be possible to install a couple of posts to discourage parking on the path?  I'm not looking to get anyone ticketed, but a good number of drivers seem to be conveniently ignorant of the rules here.

Thank you, Nick.","Parking Enforcement","1269 W Countryside Ln, Bloomington, Indiana, 47403",,,,,
163920,"2018-04-05 09:58:03","2018-06-29 11:17:54","2018-06-29 11:17:54",closed,Other,"Blocked Sidewalk","Sidewalk at 411 S Lincoln is covered in a layer of gravel.","Planning and Transportation",,Bloomington,IN,,,
164341,"2018-05-08 17:52:42","2018-05-14 15:59:33",,open,Other,"Blocked Sidewalk","918 East first st. Sidewalk on Woodlawn side obstructed by fence and vegetation","Planning and Transportation",,Bloomington,IN,,39.15927505493164,-86.52274322509766
164478,"2018-05-19 13:29:11","2018-05-23 16:55:02",,open,Other,"Blocked Sidewalk","Pedestrian bridge on E Second near Anita has overgrowing branches. Need a trim.","Planning and Transportation",,Bloomington,IN,,,
164532,"2018-05-23 15:59:01","2018-05-23 15:59:42",,open,Other,"Blocked Sidewalk","Sidewalk is blocked from both sides - by a tree on the street side of the sidewalk and a bush on the other side.","Planning and Transportation","1202 S Henderson ST",Bloomington,IN,47401,39.15253067016602,-86.52704620361328
164540,"2018-05-24 11:50:39","2018-05-31 11:45:23","2018-05-31 11:45:23",closed,Other,"Blocked Sidewalk","It is 3 days past trash pick up, and the sidewalks along South Lincoln street are still obstructed by numerous trash bins. See the section between 3rd and 1st street.",HAND,,Bloomington,IN,,,
164621,"2018-05-31 21:58:41","2019-07-16 14:47:02","2018-06-04 09:13:26",closed,Other,"Blocked Sidewalk","Hello - as of 9:30 PM on May 31st, there's a very large tree limb that appears to have come down during today's storm that is completely covering the sidewalk and some of the street at the corner of Hillside and Palmer.  I tried to move it but it's too large for one person. Thanks!","Street Department","1422 S Palmer AVE",Bloomington,IN,47401,39.15060043334961,-86.52949523925781
164671,"2018-06-04 17:11:32","2018-06-05 08:09:08",,open,Other,"Blocked Sidewalk","1017 E. First. Yew and Vines obstruct sidewalk at front walkway","Planning and Transportation",,Bloomington,IN,,39.15939331054688,-86.52197265625000
