ticket_id,enteredDate,lastModified,closedDate,status,contactMethod,category,description,department,location,city,state,zip,latitude,longitude
169056,"2019-06-20 12:12:17","2019-06-20 15:05:10","2019-06-20 15:05:10",closed,"Web Form","Blocked Sidewalk","Firestone auto 3rd and walnut has cars parked on the sidewalk.","Parking Enforcement","Expert Tire",Bloomington,IN,,39.16477203369141,-86.53340911865234
169118,"2019-06-24 10:56:45","2019-07-15 10:17:41","2019-07-15 10:17:41",closed,"Web Form","Blocked Sidewalk","Tree blocking sidewalk at 1106 E Benson Ct","Street Department","1106 E Benson Ct, Bloomington, Indiana, 47401",Bloomington,IN,,39.12217712402344,-86.52049255371094
169133,"2019-06-24 18:57:28","2019-07-10 11:17:18","2019-07-10 11:17:18",closed,"Web Form","Blocked Sidewalk","If I stay on the sidewalk because I am pushing a stroller I get smacked in the face by overgrown foliage, much of which appears to be invasive and about to seed","Planning and Transportation","E Rogers Rd, Bloomington, Indiana, 47401",Bloomington,IN,,39.13651275634766,-86.50765228271484
169139,"2019-06-25 09:19:45","2019-07-10 11:17:45","2019-07-10 11:17:45",closed,"Web Form","Blocked Sidewalk","The sidewalk on the east side of High Street (there isn't one on the west side at this point) is being overtaken by overgrowth, pushing pedestrians into a fairly high speed section of High Street. This is just north of the round about at Winslow/Rogers.","Planning and Transportation","E Rogers Rd, Bloomington, Indiana, 47401",Bloomington,IN,,39.13659286499023,-86.50787353515625
169158,"2019-06-25 21:13:44","2019-07-02 11:57:29","2019-07-02 11:57:29",closed,Other,"Blocked Sidewalk","520 S Jordan Cans left on the curb",HAND,,Bloomington,IN,,,
169159,"2019-06-25 21:16:38","2019-07-01 16:40:50","2019-07-01 16:40:50",closed,Other,"Blocked Sidewalk","520 S Jordan Cans left on the curb",HAND,,Bloomington,IN,,,
169164,"2019-06-26 09:08:21","2019-07-09 09:19:04","2019-07-09 09:19:04",closed,"Web Form","Blocked Sidewalk","There is a thick layer of gravel that has washed across the sidewalk at 411 s Lincoln.","Planning and Transportation","407 S Lincoln St, Bloomington, Indiana, 47401",Bloomington,IN,,39.16229248046875,-86.53112792968750
169165,"2019-06-26 09:09:34","2019-07-09 09:18:26","2019-07-09 09:18:26",closed,"Web Form","Blocked Sidewalk","Vegetation has completely blocked the sidewalk at 411 s lincoln","Planning and Transportation","501 N Morton St, Bloomington, Indiana, 47404",Bloomington,IN,,39.17030334472656,-86.53694915771484
169166,"2019-06-26 09:10:38","2019-08-20 11:00:32","2019-08-20 11:00:32",closed,"Web Form","Blocked Sidewalk","Gravel covering the sidewalk at 405 s lincoln","Planning and Transportation","501 N Morton St, Bloomington, Indiana, 47404",Bloomington,IN,,39.17030334472656,-86.53694915771484
169174,"2019-06-26 11:54:51","2019-06-26 11:59:34",,open,"Web Form","Blocked Sidewalk","Qué At Work cuando está el Work picases Off o velcro en una tris","Planning and Transportation","614 N Grant St, Bloomington, Indiana, 47408",Bloomington,IN,,39.17253112792969,-86.52968597412110
169186,"2019-06-27 09:24:56","2019-07-16 15:20:26","2019-07-16 15:20:26",closed,"Web Form","Blocked Sidewalk","After the storm went through on Sunday 6/23, we noticed runners and walkers were having trouble getting through on the sidewalk behind our house along Rogers Rd. Upon investigation, we found that a tree/bush next to the road had broken in the storm and was blocking the sidewalk. We cleared the debris from the sidewalk and moved it into the grassy area in between the sidewalk and the road. I would like to see the debris removed and that bush/tree trimmed. Please warn whomever works there that there may be poison ivy (I seem to have gotten it, likely from that.)","Street Department","2706 E Redwood Cir, Bloomington, Indiana, 47401",Bloomington,IN,,39.13604736328125,-86.49962615966797
169251,"2019-07-02 10:44:35","2020-01-31 13:50:59","2020-01-31 13:50:59",closed,"Phone Call","Blocked Sidewalk","This property is covered in weeds and bushes that block the sidewalk. Pedestrians are forced to walk dangerously close to traffic. If the weeds consist of grass, contact HAND for a Title 6 ticket. If the weeds are blocking the sidewalk enforce under Title 12.","Planning and Transportation","1402 N Walnut ST",Bloomington,IN,47408,39.17918777465820,-86.53312683105469
169289,"2019-07-04 20:25:03","2019-07-23 06:36:41","2019-07-23 06:36:41",closed,"Web Form","Blocked Sidewalk","I tersectio. W 37/69 west of auto repair place on Deborah drive, blocking way across on ramp","Street Department","Hickory Heights Tlpk, Bloomington, Indiana, 47403",Bloomington,IN,,39.13790512084961,-86.57474517822266
169296,"2019-07-05 12:47:09","2020-01-31 13:36:14","2020-01-31 13:36:14",closed,"Web Form","Blocked Sidewalk","The bushes from Topos403  (403 N. Walnut St) are have overgrown their fence and blocking the side walk along 8th St just west of Walnut.","Planning and Transportation","Topo's 403",Bloomington,IN,,39.16956710815430,-86.53379821777344
169311,"2019-07-07 20:05:44","2019-07-11 12:03:42","2019-07-11 12:03:42",closed,"Web Form","Blocked Sidewalk","Tree blocking sidewalk at 1106 E Benson Ct","Street Department","1106 E Benson Ct, Bloomington, Indiana, 47401",Bloomington,IN,,39.12212371826172,-86.52058410644531
169314,"2019-07-08 09:59:24","2019-07-11 17:50:17",,open,"Phone Call","Blocked Sidewalk","Limbs and bushes blocking the sidewalk.","Planning and Transportation","817 N Washington ST",Bloomington,IN,47408,39.17420959472656,-86.53254699707031
169318,"2019-07-08 12:29:20","2019-07-10 11:16:00","2019-07-10 11:16:00",closed,"Web Form","Blocked Sidewalk","The sidewalk is complete blocked by trees / bushes on Grimes just east of Henderson on the north side of the street.","Planning and Transportation","601-699 E Grimes Ln, Bloomington, Indiana, 47401",Bloomington,IN,,39.15332031250000,-86.52677917480469
169320,"2019-07-08 12:31:53","2019-07-10 11:16:26","2019-07-10 11:16:26",closed,"Web Form","Blocked Sidewalk","On the north side of Grimes the sidewalk is blocked by a tree branch hanging down and touching the ground. I had to go out into the street to get around. This was west of Henderson, and I think it was a little east of Palmer.","Planning and Transportation","519 E Grimes Ln, Bloomington, Indiana, 47401",Bloomington,IN,,39.15334701538086,-86.52862548828125
169358,"2019-07-10 09:04:14","2019-07-10 11:13:54","2019-07-10 11:13:54",closed,"Web Form","Blocked Sidewalk","High Street sidewalk on the Northeast corner of the Winslow/High/Rogers roundabout is becoming very difficult to pass due to overgrowth. This needs to be trimmed back to support access from the Sycamore Knolls neighborhood and surrounding area down onto the Jackson Creek Trail.","Planning and Transportation","S High St, Bloomington, Indiana, 47401",Bloomington,IN,,39.13656234741211,-86.50794982910156
169397,"2019-07-12 22:49:43","2019-07-19 11:51:34","2019-07-19 11:51:34",closed,"Web Form","Blocked Sidewalk","Tenth street sidewalk on north side east of Washington - overgrown!","Planning and Transportation","110 E 10th St, Bloomington, Indiana, 47408",Bloomington,IN,,39.17159271240234,-86.53237915039062
169401,"2019-07-13 17:31:48","2019-07-15 10:14:21","2019-07-15 10:14:21",closed,"Web Form","Blocked Sidewalk","Second request - either the sign is important to notify motorists or it’s not?  Also blocks sidewlak","Street Department","3000-3318 W Tapp Rd, Bloomington, Indiana, 47403",Bloomington,IN,,39.13707351684570,-86.57489776611328
169470,"2019-07-18 17:53:09","2019-07-19 09:19:12","2019-07-19 09:19:12",closed,"Web Form","Blocked Sidewalk","Repeatedly (almost daily) they park a car blocking the sidewalk.","Parking Enforcement","1500 S Highland Ave, Bloomington, Indiana, 47401",Bloomington,IN,,39.15032196044922,-86.51699829101562
169527,"2019-07-24 08:43:08","2019-08-05 16:26:47","2019-08-05 16:26:47",closed,Other,"Blocked Sidewalk","East side of 2750 Sara rd. a large tree branch is blocking the sidewalk.","Planning and Transportation",,Bloomington,IN,,,
169538,"2019-07-25 10:46:51","2019-07-25 17:28:09","2019-07-25 17:28:09",closed,"Web Form","Blocked Sidewalk","Hi. The footpath between Southdowns and Greenwood Avenue, which is part of a 'safe route to school', is blocked by an overgrown honeysuckle, which needs to be cut back. It is a danger to walkers and cyclists and makes wheelchair access difficult, as everyone has to go round it onto private property. Could you please cut it back? Thank you.","Planning and Transportation","1929 E Southdowns Dr, Bloomington, Indiana, 47401",Bloomington,IN,,39.15582275390625,-86.51044464111328
169557,"2019-07-26 09:19:12","2019-07-30 11:58:54","2019-07-30 11:58:54",closed,"Web Form","Blocked Sidewalk","The tenant leaves their trash can on the sidewalk all week long, obstructing pedestrian traffic.",HAND,"547 S Lincoln St, Bloomington, Indiana, 47401",Bloomington,IN,,39.15977478027344,-86.53116607666016
169576,"2019-07-27 15:32:54","2019-07-29 15:59:35","2019-07-29 15:59:35",closed,Other,"Blocked Sidewalk","NW corner 2nd&patterson, facing SB on patterson.  This sidewalk open or closed? Sign laying down in sidewalk.","Planning and Transportation",,Bloomington,IN,,,
169577,"2019-07-27 15:36:46","2019-08-02 11:40:15","2019-08-02 11:40:15",closed,Other,"Blocked Sidewalk","NE corner 2nd&patterson. Facing WB on 2nd. This ones closed, right? The hole is more than 6"" deep in spots.","Planning and Transportation",,Bloomington,IN,,,
169578,"2019-07-27 15:40:58","2019-07-29 15:56:17",,open,Other,"Blocked Sidewalk","NE corner 2nd&patterson, facing SB on patterson at corner of perfection auto glass bldg. This patch is permanent? Is that ""good enough"", ""workman like quality"" given volumes and closure of sidewalk on other side of street? Saw 2 ppl use this sidewalk just while I was typing this note.","Planning and Transportation",,Bloomington,IN,,,
169579,"2019-07-27 15:46:32","2019-08-12 14:58:25","2019-08-12 14:58:25",closed,Other,"Blocked Sidewalk","1305 W bloomfield (co-op). Sidewalk on south side of street.  Is this one open? A guy was just arrested for walking in the street here.  I cant tell what was wrong with him, the sidewalks are all so clear!","Street Department",,Bloomington,IN,,,
169580,"2019-07-27 15:49:11","2019-09-04 12:04:13","2019-09-04 12:04:13",closed,Other,"Blocked Sidewalk","1319 W bloomfield, south sidewalk. Surely this one is closed?? But I havent had a single safe option for crossing 2nd since adams, and the north sidewalk was closed at adams","Planning and Transportation",,Bloomington,IN,,,
169581,"2019-07-27 15:53:03","2019-11-19 10:13:46","2019-11-19 10:13:45",closed,Other,"Blocked Sidewalk","Vacant lot roughly 1351 W bloomfield, south sidewalk. Sidewalk burried under sand, grass.","Planning and Transportation",,Bloomington,IN,,,
169618,"2019-07-31 07:53:15","2019-11-20 10:32:11","2019-11-20 10:32:11",closed,"Web Form","Blocked Sidewalk","The sidewalk on the west side of College Mall Rd just north of Moores Pike there is a tree that has branches hanging to about 4-5 feet over the ground, making it so that both pedestrians and cyclists have to duck to get below it. I believe the tree is the responsibility of Gentry Quarters, but I am unable to find contact information for the company to ask them to address it. I'm hoping the city can. Thank you.","Planning and Transportation","1376 S College Mall Rd, Bloomington, Indiana, 47401",Bloomington,IN,,39.15136337280273,-86.49784088134766
169636,"2019-07-31 17:47:38","2019-08-05 13:01:12","2019-08-05 13:01:12",closed,"Web Form","Blocked Sidewalk","113 n 7th st.","Planning and Transportation","316 N College Ave, Bloomington, Indiana, 47404",Bloomington,IN,,39.16859054565430,-86.53453063964844
169686,"2019-08-03 13:46:52","2019-08-14 11:25:02","2019-08-14 11:25:02",closed,"Web Form","Blocked Sidewalk","First St at the NW corner of First and High is blocked by overgrown shrubbery","Planning and Transportation","720 S High St, Bloomington, Indiana, 47401",Bloomington,IN,,39.15932083129883,-86.50888061523438
169731,"2019-08-06 20:23:16","2019-09-19 16:57:46","2019-09-19 16:57:46",closed,"Web Form","Blocked Sidewalk","Worse than a scooter  - cannot get by on sidewalk","Planning and Transportation","Ivory Tower Advertising",Bloomington,IN,,39.17267990112305,-86.53320312500000
169739,"2019-08-07 09:05:33","2019-08-07 10:27:55","2019-08-07 10:27:55",closed,"Web Form","Blocked Sidewalk","Pickup pulled into sidewalk at Turkuaz cafe. 3rd and Lincoln","Parking Enforcement","Turkuaz Cafe",Bloomington,IN,,39.16465759277344,-86.53102111816406
169758,"2019-08-07 16:54:22","2019-08-22 16:28:15","2019-08-22 16:28:15",closed,"Web Form","Blocked Sidewalk","540 s Lincoln sidewalk blocked by overgrowth","Planning and Transportation","401-499 N Morton St, Bloomington, Indiana, 47404",Bloomington,IN,,39.17021179199219,-86.53694915771484
169780,"2019-08-08 19:28:08","2019-11-20 10:42:25","2019-11-20 10:42:25",closed,"Web Form","Blocked Sidewalk","The sidewalk on Azalea Lane next to Winslow Woods is likely the responsibility of the city of Bloomington. The brush that is overgrown the sidewalk needs to be removed immediately. Yesterday I saw over 10 athletes running into traffic to try and avoid running in the brush because there is no room on the sidewalk to walk.","Planning and Transportation","901-991 E Azalea Ln, Bloomington, Indiana, 47401",Bloomington,IN,,39.14335250854492,-86.52183532714844
169786,"2019-08-09 13:40:05","2019-08-09 15:57:54","2019-08-09 15:57:53",closed,"Web Form","Blocked Sidewalk","Metal wire dangling from power line directly above sidewalk.","Planning and Transportation","3815-3839 E 10th St, Bloomington, Indiana, 47408",Bloomington,IN,,39.17173767089844,-86.48881530761719
169814,"2019-08-11 13:05:34","2019-08-12 09:30:21","2019-08-12 09:30:21",closed,"Web Form","Blocked Sidewalk","Multiple cars parked on sidewalk at firestone auto. 3rd and walnut.","Parking Enforcement","221 S Walnut St, Bloomington, Indiana, 47404",Bloomington,IN,,39.16480636596680,-86.53331756591797
169819,"2019-08-12 08:47:14","2019-08-12 09:29:57","2019-08-12 09:29:57",closed,"Web Form","Blocked Sidewalk","Firestone Auto (3rd and Walnut) had multiple cars parked on and blocking the sidewalk over the weekend. This is happening on a constant basis (see the uReport history) and blocks the sidewalk along a downtown corridor. Can the city step up enforcement at this location to ensure the sidewalks are kept clear?","Parking Enforcement","Expert Tire",Bloomington,IN,,39.16487121582031,-86.53334045410156
169822,"2019-08-12 09:12:28","2019-08-12 09:29:12","2019-08-12 09:29:12",closed,"Web Form","Blocked Sidewalk","Blue SUV parked on sidewalk at Firestone Auto. 3rd at Walnut.","Parking Enforcement","501 N Morton St, Bloomington, Indiana, 47404",Bloomington,IN,,39.17030334472656,-86.53694915771484
169860,"2019-08-13 12:01:10","2019-08-13 12:26:34","2019-08-13 12:26:34",closed,"Web Form","Blocked Sidewalk","The sidewalk between the Brownstone Apartments and Indiana Ave on E 13th St is completely overgrown with weeds from the railroad right of way.","Planning and Transportation","500-598 E 13th St, Bloomington, Indiana, 47408",Bloomington,IN,,39.17522048950195,-86.52767944335938
169908,"2019-08-15 20:43:52","2019-08-16 09:52:27",,open,"Web Form","Blocked Sidewalk","Three Lime scooters are blocking the sidewalk in front of my apartment building where several disabled people live.",Mobility,"269-399 W 4th St, Bloomington, Indiana, 47404",Bloomington,IN,,39.16559219360352,-86.53713226318360
169910,"2019-08-16 01:31:07","2019-09-03 11:18:20","2019-09-03 11:18:20",closed,"Web Form","Blocked Sidewalk","Lots of vegetation across sidewalk on south side of E. Second St. east of Woodscrest Dr.","Planning and Transportation","2511 E 2nd St, Bloomington, Indiana, 47401",Bloomington,IN,,39.16094589233398,-86.50228118896484
169922,"2019-08-16 19:21:12","2019-08-19 16:05:29","2019-08-19 16:05:29",closed,"Web Form","Blocked Sidewalk","Cars parked on and blocking the sidewalk. Firestone Auto. 3rd and Walnut","Parking Enforcement","221 S Walnut St, Bloomington, Indiana, 47404",Bloomington,IN,,39.16482162475586,-86.53329467773438
169942,"2019-08-19 12:15:11","2019-08-19 16:04:20","2019-08-19 16:04:20",closed,"Web Form","Blocked Sidewalk","Cat parked on sidewalk at 213 n grant","Parking Enforcement","501 N Morton St, Bloomington, Indiana, 47404",Bloomington,IN,,39.17030334472656,-86.53694915771484
169966,"2019-08-20 13:48:19","2019-08-20 15:11:57","2019-08-20 15:11:57",closed,"Web Form","Blocked Sidewalk","red car parked on sidewalk. just outside of the quaff on brewing on grant st.","Parking Enforcement","Art Pygmalion's Supplies",Bloomington,IN,,39.16699981689453,-86.52971649169922
169981,"2019-08-21 12:16:01","2019-08-21 13:30:28","2019-08-21 13:30:28",closed,"Web Form","Blocked Sidewalk","Car parked on sidewalk 213 n grant","Parking Enforcement","501 N Morton St, Bloomington, Indiana, 47404",Bloomington,IN,,39.17030334472656,-86.53694915771484
169984,"2019-08-21 15:46:38","2019-08-21 16:00:16","2019-08-21 16:00:16",closed,"Web Form","Blocked Sidewalk","Car parked on sidewalk. Big woods brewing on grant across from library.","Parking Enforcement","402 E 6th St, Bloomington, Indiana, 47408",Bloomington,IN,,39.16725921630859,-86.52974700927734
170003,"2019-08-22 19:51:50","2019-09-18 09:11:44","2019-09-18 09:11:44",closed,"Web Form","Blocked Sidewalk","3rd street just west of Fairview","Planning and Transportation","708 W 3rd St, Bloomington, Indiana, 47404",Bloomington,IN,,39.16433715820312,-86.54124450683594
170006,"2019-08-23 09:40:29","2019-08-23 11:11:28","2019-08-23 11:11:28",closed,"Web Form","Blocked Sidewalk","2 cars parked on sidewalk. 321 n Washington. Cars are sidewalk around corner on 8th.","Parking Enforcement","501 N Morton St, Bloomington, Indiana, 47404",Bloomington,IN,,39.17030334472656,-86.53694915771484
170007,"2019-08-23 09:41:36","2019-08-23 11:11:58","2019-08-23 11:11:58",closed,"Web Form","Blocked Sidewalk","Car parked on sidewalk 418 n Washington","Parking Enforcement","501 N Morton St, Bloomington, Indiana, 47404",Bloomington,IN,,39.17030334472656,-86.53694915771484
170009,"2019-08-23 10:49:49","2019-08-23 10:55:44","2019-08-23 10:55:44",closed,"Web Form","Blocked Sidewalk","Referring to 169561. Sidewalk is still blocked. Nothing has been done.","Planning and Transportation","101-199 E 15th St, Bloomington, Indiana, 47408",Bloomington,IN,,39.17686843872070,-86.53279113769531
170015,"2019-08-23 16:07:11","2019-08-26 09:32:58","2019-08-26 09:32:58",closed,"Web Form","Blocked Sidewalk","120 East 8th St. Two cars blocking the sidewalk.","Parking Enforcement","100-198 E 8th St, Bloomington, Indiana, 47408",Bloomington,IN,,39.16947174072266,-86.53251647949219
170024,"2019-08-24 11:13:59","2019-08-26 11:45:13","2019-08-26 11:45:13",closed,"Web Form","Blocked Sidewalk","434 E 2nd street. Cars all along the driveway, extending fully across the sidewalk and to the street. It is impossible for people to proceed safely, especially if they have a wheelchair or stroller and cannot squeeze between cars. .","Parking Enforcement","434 E 2nd St, Bloomington, Indiana, 47401",Bloomington,IN,,39.16133499145508,-86.52847290039062
170046,"2019-08-26 08:58:40","2019-09-25 11:39:15","2019-09-25 11:39:15",closed,"Web Form","Blocked Sidewalk","The branches encroaching on the sidewalk have gotten to be too much on High St. just South of Wimbleton. Pedestrian traffic is significant here, especially now that school has started, and it's honestly challenging for adults to get past one another while ducking under the branches. This is a popular place for people to ride their bikes on the sidewalk, taking their kids to school, and an adult biking on the sidewalk going down the hill might be in danger of being decapitated by all the branches.","Planning and Transportation","2102 E Wimbleton Ln, Bloomington, Indiana, 47401",Bloomington,IN,,39.14377593994141,-86.50821685791016
170084,"2019-08-27 09:13:13","2019-08-27 10:01:07","2019-08-27 10:01:07",closed,"Web Form","Blocked Sidewalk","There is a red vehicle constantly parked on the sidewalk at 1500 south highland, just south of Hillside.","Parking Enforcement","1500 S Highland Ave, Bloomington, Indiana, 47401",Bloomington,IN,,39.15030670166016,-86.51706695556640
170096,"2019-08-27 19:26:15","2019-08-28 06:49:07","2019-08-28 06:49:07",closed,"Web Form","Blocked Sidewalk","Some equipment from the construction along the bypass blocking the multi-use path. North side, just west of the Genesis church.","Planning and Transportation","581-735 E Matlock Rd, Bloomington, Indiana, 47408",Bloomington,IN,,39.18641281127930,-86.52583312988281
170139,"2019-08-29 20:20:30","2019-08-30 08:35:54","2019-08-30 08:35:54",closed,"Web Form","Blocked Sidewalk","Still waiting for this stretch of sidewalk to be cleared of brush by city.","Planning and Transportation","901-991 E Azalea Ln, Bloomington, Indiana, 47401",Bloomington,IN,,39.14347457885742,-86.52165222167969
170147,"2019-08-30 18:45:01","2019-09-26 08:40:02","2019-09-26 08:40:02",closed,"Web Form","Blocked Sidewalk","Segment of sidewalk on east side of Sare Road between E Winston St and E Moores Pike is extremely is difficult to walk due to vegetation growing on and through fence. Walkers/runners/cyclists are forced to walk/run/ride on grass.","Planning and Transportation","501 N Morton St, Bloomington, Indiana, 47404",Bloomington,IN,,39.17030715942383,-86.53694152832031
170167,"2019-09-01 15:29:40","2019-09-03 11:16:17","2019-09-03 11:16:17",closed,"Web Form","Blocked Sidewalk","Sidewalk on south side of E2nd between Woodscrest and College Mall is blocked by overgrown bushes.","Planning and Transportation","601 S Woodscrest Dr, Bloomington, Indiana, 47401",Bloomington,IN,,39.16086578369141,-86.50187683105469
170168,"2019-09-01 16:12:21","2019-09-04 09:06:44","2019-09-04 09:06:44",closed,"Web Form","Blocked Sidewalk","A tree between the road and sidewalk at 1002 E. Heather has two large branches (about 9 inch diameters) broken off. The branches are blocking the sidewalk and extending into the road. The remained of the tree may have to be removed also.","Street Department","732 E Pepperridge Dr, Bloomington, Indiana, 47401",Bloomington,IN,,39.12483215332031,-86.52239227294922
170184,"2019-09-03 08:52:28","2019-09-03 10:35:20","2019-09-03 10:35:20",closed,"Web Form","Blocked Sidewalk","Car on sidewalk outside quaff on on grant st","Parking Enforcement","116 N Grant St, Bloomington, Indiana, 47408",Bloomington,IN,,39.16705322265625,-86.52972412109375
170185,"2019-09-03 09:40:06","2019-09-03 10:28:26","2019-09-03 10:28:26",closed,"Web Form","Blocked Sidewalk","Metal cable dangling over sidewalk from power line at head-height. North side of street, directly next to Barrington bus stop.","Planning and Transportation","3815-3839 E 10th St, Bloomington, Indiana, 47408",Bloomington,IN,,39.17179489135742,-86.48876953125000
170203,"2019-09-04 07:25:31","2019-09-25 11:43:44","2019-09-25 11:43:44",closed,"Web Form","Blocked Sidewalk",Overgrown,"Planning and Transportation","400-498 E Cottage Grove Ave, Bloomington, Indiana, 47408",Bloomington,IN,,39.17256546020508,-86.52956390380860
170249,"2019-09-06 14:47:22","2019-09-06 14:48:55","2019-09-06 14:48:55",closed,"Web Form","Blocked Sidewalk","Pedestrian crosswalk needed at 10th St. and Pete Ellis Drive.","Planning and Transportation","501 N Morton St, Bloomington, Indiana, 47404",Bloomington,IN,,39.17051315307617,-86.53685760498047
170271,"2019-09-09 12:44:42","2019-09-12 17:09:21","2019-09-12 17:09:21",closed,"Web Form","Blocked Sidewalk","The corner of the construction fence on E. 10th St. where Crosstown Shopping Center used to be (by Sobon and Jimmy John's) keeps getting pushed out more and more into the sidewalk, making it inaccessible to wheelchairs and a trip hazard even for those with no mobility issues.","Planning and Transportation","1811-1873 E 10th St, Bloomington, Indiana, 47408",Bloomington,IN,,39.17159652709961,-86.51035308837890
170285,"2019-09-10 09:27:22","2019-09-10 11:33:38",,open,"Web Form","Blocked Sidewalk","A broken, low lying limb is blocking the sidewalk in front of the home at 733 E. Winslow Farm Dr.  I am requesting that this limb be removed.","Planning and Transportation","733 E Winslow Farm Dr, Bloomington, Indiana, 47401",Bloomington,IN,,39.13833618164062,-86.51823425292969
170292,"2019-09-10 14:14:24","2019-09-10 14:31:59","2019-09-10 14:31:59",closed,"Web Form","Blocked Sidewalk","Trash containers are left by residents and city trash workers on  sidewalks. I've run across this issue on Washington St as well as other streets.","Sanitation Department","8500-8540 S Sacramento Ave, Chicago, Illinois, 60652",Bloomington,IN,,41.73765945434570,-87.69755554199219
170302,"2019-09-11 09:26:59","2019-09-11 09:34:25","2019-09-11 09:34:25",closed,Other,"Blocked Sidewalk","trash and boxes blocking sidewalk",HAND,,Bloomington,IN,,39.16077041625977,-86.52402496337890
170359,"2019-09-14 20:25:55","2019-09-16 09:47:55","2019-09-16 09:47:55",closed,"Web Form","Blocked Sidewalk","The plants on both sides of the path are a little overgrown but the real problem is a very solid low hanging branch that is a real hazard. And another low hanging branch that is likely to hit you in the face with pears.","Planning and Transportation","1714 E Caradon Hl, Bloomington, Indiana, 47401",Bloomington,IN,,39.13673400878906,-86.51202392578125
170372,"2019-09-16 19:13:12","2019-09-17 09:22:05","2019-09-17 09:22:05",closed,"Web Form","Blocked Sidewalk","1500 s Huntington. One car on the sidewalk and another one on the lawn. This happens all the time at this house.","Parking Enforcement","1500-1598 S Huntington Dr, Bloomington, Indiana, 47401",Bloomington,IN,,39.15041351318359,-86.52094268798828
