ticket_id,enteredDate,lastModified,closedDate,status,contactMethod,category,description,department,location,city,state,zip,latitude,longitude
161801,"2017-11-12 13:01:11","2017-11-29 11:19:26","2017-11-29 11:19:26",closed,Other,"Sidewalk Requests","grafitti on a utility pole ouside my house 413 W. Howe St","Public Works Department",,Bloomington,IN,,,
164627,"2018-06-01 11:31:00","2018-07-30 14:22:23","2018-07-30 14:22:23",closed,Other,"Sidewalk Requests","I live at 324 South Jackson. Our WPA sidewalk has become a hazard due to broken stones. Can the city help us with its repair? Thank you.",HAND,,Bloomington,IN,,,
164943,"2018-06-25 11:28:40","2018-06-25 11:28:41",,open,Other,"Sidewalk Requests","There are several city tree's growing out of the side walk that are touching the building at 108 East 6th street that need to be trimmed back.",,"108 E 6th ST",Bloomington,IN,47408,39.16738510131836,-86.53305053710938
165204,"2018-07-18 15:15:01","2018-07-18 16:28:28","2018-07-18 16:28:28",closed,Other,"Sidewalk Requests","I am the homeowner at 3817 S Woods Edge Bend. Can the city repair my sidewalk? My insurance company is saying this is necessary, and I don't know how to get this done.","Public Works Department","3812 S Woods Edge BND",Bloomington,IN,47401,39.12644195556641,-86.51638793945312
165230,"2018-07-20 17:45:17","2018-08-13 10:16:15","2018-08-13 10:16:15",closed,Other,"Sidewalk Requests","Thank you in advance for reading my inquiry. I would like to suggest a sidewalk due to a safety concern that effects children and disabled persons. Referring to the intersection at E Rogers Road and the Stands Drive. There is no sidewalk along this street connecting the stands road sidewalk to the crosswalk at the roundabout at the bottom of the hill (i.e., the area on the south side of E Rogers Road). Moreover, the sidewalk on the other side of the street is completely inaccessible for those with impaired motor function or wheelchairs (there is a large hill with steps only and no ramp). There are two major concerns here: (1) there is no possible way for a disabled person with a wheelchair to travel on E Rogers road (from the roundabout at the bottom of the hill up to the stands drive). (2) There is no way for families and children to safely walk to Child's elementary from this location (the Stands dr). Given that E Rogers road is a busy street with limited visibility for drivers and no crosswalk exists at the intersection of  the Stands drive and E Rogers Road, it is extremely dangerous for children and families that wish to walk their children to the designated elementary school - Child's Elementary. This is the only direct walking path to Child's Elementary for all of the constituents that leave in the Stands neighborhood. There is no sidewalk on the south side of E Rogers Rd to connect the Stands Dr with the crosswalk at the bottom of the hill at the roundabout. Several constituents have expressed a safety concern. I also witnessed one woman and child almost get hit by a car at this busy intersection as they attempted to cross the street. I'd be happy to answer any additional questions. Thank you for reviewing my request.",,"1550 East Rogers Road",Bloomington,IN,,39.13592910766602,-86.50454711914062
166136,"2018-10-05 13:49:23","2018-11-19 14:53:23","2018-11-19 14:53:23",closed,Other,"Sidewalk Requests","The sidewalk ends abruptly in a very dangerous intersection. This turn needs to be improved for pedestrian safety. The sidewalk should not be on only one side of the road, particularly in such a dangerous location for pedestrians to cross the road, just to have the sidewalk reappear only meters away.","Planning and Transportation","2495 S Walnut Street PIKE",Bloomington,IN,47401,39.13572692871094,-86.52868652343750
166534,"2018-11-14 11:17:21","2018-11-15 10:54:37","2018-11-15 10:54:37",closed,"Web Form","Sidewalk Requests","I'm an IU Bloomington student who walks to the stadium everyday to take the IU buses to class. There are no sidewalks on my walk from Brownstone Terrace to the stadium which forces me to walk on the side of the road, where student drivers who don't pay attention swerve around me at the last second. Additionally when the weather is bad, I'm even forced to walk in the road, putting myself at risk to get hit by a car. I'm also proposing more off campus lighting & would love to meet with someone about these issues to come up with an effective plan. It's unsafe walking home from a late night class or to an early morning class & not being able to see your surroundings. Some of the city lights don't even work. If more light poles were installed, it would reduce the off campus crime rate. The city of Bloomington, not IU, is reponsible to address these issues because it's there property.","Public Works Department","300-498 E Brownstone Dr, Bloomington, Indiana, 47408",Bloomington,IN,,39.17547988891602,-86.52989959716797
166760,"2018-12-06 14:55:27","2018-12-07 09:20:54","2018-12-07 09:20:54",closed,Letter,"Sidewalk Requests","We received a request from a young woman living in Park Ridge East. She is concerned that there is no sidewalk on Sheffield Drive between Plymouth Road and Park Ridge Road as this is a path for children to walk to Park Ridge East Park. The bus picks up children in this area and they have no where to wait for the bus.",,"4301 E Sheffield DR",Bloomington,IN,47408,39.17024230957031,-86.47610473632812
166780,"2018-12-09 13:49:25","2019-01-15 07:16:59","2019-01-15 07:16:59",closed,"Web Form","Sidewalk Requests","West side of 500 block of S. Washington.  Sidewalk cracked, broken, and heaved up by tree growth.  Does the city claim sidewalk repair is the responsibility of adjacent property owner?  What about the goal of walkability?","Street Department","501 N Morton St, Bloomington, Indiana, 47404",Bloomington,IN,,39.17030334472656,-86.53694915771484
167535,"2019-02-19 10:01:30","2019-02-21 09:13:18","2019-02-21 09:13:18",closed,"Web Form","Sidewalk Requests","2 sections of upended sidewalks potentially hazardous to pedestrian traffic in front of 3712 E Silver Creek Ct. Appears to be caused by shallow tree roots.","Street Department","501 N Morton St, Bloomington, Indiana, 47404",Bloomington,IN,,39.17030715942383,-86.53694152832031
167566,"2019-02-20 21:44:55","2019-02-22 13:08:41","2019-02-22 13:08:41",closed,"Web Form","Sidewalk Requests","There are no sidewalks at all on S Park Ave., S. Stull Ave., or S. Fess Ave between Bryan Park and Hillside (except on Grimes St).","Planning and Transportation","1318 S Park Ave, Bloomington, Indiana, 47401",Bloomington,IN,,39.15155410766602,-86.52397155761719
167674,"2019-03-04 12:41:08","2019-03-04 13:24:56","2019-03-04 13:24:56",closed,"Web Form","Sidewalk Requests","We would like to expand our driveway, but that would involve changing the curb and sidewalk around our current driveway.  Who do I talk to about this?","Planning and Transportation","1708 E Ruby Ln, Bloomington, Indiana, 47401",Bloomington,IN,,39.15451431274414,-86.51276397705078
167802,"2019-03-15 21:49:29","2019-03-19 14:31:17","2019-03-19 14:31:17",closed,"Web Form","Sidewalk Requests","Hello,
We live in the Echo Park community (2780 S. Walnut St. Pk.). We basically do not have safe walking access to the nearby Winslow Street. Families and the elderly risk their lives walking on the side of the asphalt, at a pretty dagerous intersection (cars do not have good sight when they turn to this street). Adding a short sidewalk would solve this problem. See picture attached (the problematic area is marked in red). It is a tragedy waiting to happen. 
Thank you.","Planning and Transportation","101-199 E Sunny Slopes Dr, Bloomington, Indiana, 47401",Bloomington,IN,,39.13367080688477,-86.52831268310547
168391,"2019-05-03 18:47:52","2019-05-15 13:53:33","2019-05-15 13:53:33",closed,"Web Form","Sidewalk Requests","In FYI about water meter on Fess north of 4th Street.  When I stepped on the concrete around the meter, it all levered up.  I think the gap is visible in the photo.


Utilities checked area on Fess N. of Second- found no problem with meter pits- did see an open hole in tree plot marked in white.Does not appear to be utility related.","Utilities Meter Services","400 W 7th St, Bloomington, Indiana, 47404",Bloomington,IN,,39.16864776611328,-86.53764343261719
168450,"2019-05-08 13:42:24","2019-05-13 14:35:53","2019-05-13 14:35:53",closed,"Web Form","Sidewalk Requests","Unsafe dip for wheelchair users. I myself was thrown from the charge going three to four miles an hour","Street Department","2118-2148 E 3rd St, Bloomington, Indiana, 47401",Bloomington,IN,,39.16418457031250,-86.50797271728516
168572,"2019-05-17 12:11:52","2019-05-17 13:27:51","2019-05-17 13:27:51",closed,"Web Form","Sidewalk Requests","This is a tree plot / water meter pit issue, a follow up on #168554. The meter in question is at 514 S Fess.  You all couldn't it because someone---safety-conscious resident maybe, or self-motivated meter reader apparently had filled the hole in with dirt and tamped it tight.  So, yes, resolved","Utilities Director's Office","501 N Morton St, Bloomington, Indiana, 47404",Bloomington,IN,,39.17030334472656,-86.53694915771484
169655,"2019-08-01 16:12:03","2019-08-01 16:12:03",,open,"Phone Call","Sidewalk Requests","Lot 82 and 83 -- fire hazard and overgrowth, sidewalks not ADA accessible, code violations",,"1600 N Willis DR LOT 82",Bloomington,IN,47404,39.18274688720703,-86.54434204101562
169738,"2019-08-07 08:13:04","2019-08-07 08:13:05",,open,"Web Form","Sidewalk Requests","I would like to request sidewalks/speed bumps on Elliston Dr. in Sherwood Oaks Neighborhood.  Elliston is the main thourough fair to Sherwood Oaks Park, Jackson Creek Trail and Olcott Park, which also leads to Childs Elementary and Jackson Creek Middle School.  There is significant foot traffic daily of adults, kids and pets being walked. Children go to school on this route and yet there is nothing provided to keep them safe.  There are currently no sidewalks to keep foot traffic safe and no speed bumps to slow down traffic.  People speed through this area whether local traffic or visitors to the park and what the city has done to date is not enough.  Someone is going to get hurt and it will be on the onus of those who have chose to do nothing to keep pedestrians safe.  Please consider making a change and putting sidewalks/speed bumps in to allow for safe travels for all in this area.  

Thank you",,"1200-1398 E Elliston Dr, Bloomington, Indiana, 47401",Bloomington,IN,,39.12927627563477,-86.51770782470703
170027,"2019-08-24 15:28:05","2019-08-24 15:28:05",,open,"Web Form","Sidewalk Requests","Lacking accessible sidewalk ramps in Sherwood oaks neighborhood.",,"1101-1149 E Allendale Dr, Bloomington, Indiana, 47401",Bloomington,IN,,39.13089370727539,-86.52128601074219
171307,"2019-12-30 10:21:15","2019-12-30 10:21:15",,open,Other,"Sidewalk Requests","Comment from Josh Conway on Facebook: How about getting a sidewalk on N Crescent rd between Marquis and fountain drive???
I see people forced to take wheelchairs up and down that section of city road. People in cars just keep buzzing them.","Council Office","973-1211 N Crescent Rd, Bloomington, Indiana, 47404",Bloomington,IN,,39.17609405517578,-86.55650329589844
