ticket_id,enteredDate,lastModified,closedDate,status,contactMethod,category,description,department,location,city,state,zip,latitude,longitude
150060,"2016-01-02 12:06:09","2016-09-11 22:02:05","2016-01-28 14:29:27",closed,Other,"Sidewalk Requests","sidewalk floods in front house when it rains. puddle is too deep to walk through. very inconvenient.","Street Department","420 W 4th ST",Bloomington,IN,47404,39.16575241088867,-86.53849792480469
150887,"2016-03-01 14:50:19","2017-08-17 11:46:26","2017-08-17 11:46:26",closed,Other,"Sidewalk Requests","The sidewalk to the east of our front steps is cracked.  A large mud puddle stays there, such that we need to keep it covered in straw in order for pedestrians not to slip and get muddy.  This section is just next to the new sidewalks planned for the intersection of Fairview and Dodds streets.  Including this segment in your replacements and repairs will allow an efficient, strategic improvement.  Thank you.","Street Department","608 W Dodds ST",Bloomington,IN,47403,39.15755081176758,-86.54075622558594
151223,"2016-03-25 16:14:44","2016-09-11 22:02:05","2016-08-22 10:31:49",closed,Other,"Sidewalk Requests","I am the President of the Eastern Height Neighborhood Association and our community has been in desperate need for sidewalks along 10th Street from  E Etter Drive through to Grandview neighborhood, as well as crosswalks to University Elementary School. The Grandview, Park Ridge East and Park Ridge neighborhood organizations are also requesting this, as well as University Elementary School. We understand the complications with the State, but a meeting is needed to begin the formal process of gaining walking access in this area. Not only will it allow our children to walk to school, but it will provide community members in Tamarron and Eastern Heights the ability to safely walk to the bus stop and access the University and downtown without the use of cars. Please contact me in order to discuss how we can help you help us. 
Thank you very much.
Lauren Dula",,"4151-4177 East 10th Street",Bloomington,IN,,39.17425155639648,-86.48178863525390
151235,"2016-03-27 15:31:27","2016-09-11 22:02:05","2016-08-22 10:32:09",closed,Other,"Sidewalk Requests","Since I live at 4200 E Deckard Drive, I am a resident of Eastern Heights neighborhood and our community has been in desperate need for sidewalks along 10th Street from E. Etter Drive through to Grandview neighborhood. We also need crosswalks to University Elementary School. We understand the complications with it being a State road, but a meeting is needed to begin the formal process of gaining walking access in this area. Not only will it allow our children to walk to school, but it will provide community members in Tamarron and Eastern Heights the ability to safely walk to the bus stop and access the University and downtown without the use of cars.",,,Bloomington,IN,,,
151236,"2016-03-27 15:45:10","2016-09-11 22:02:05","2016-08-22 10:32:29",closed,Other,"Sidewalk Requests","We need sidepaths on east 10th at least to University School. Someone will be hit walking ""the dip"" Its been needed for years. More walkers in the last few!",,,Bloomington,IN,,,
151239,"2016-03-27 19:39:28","2018-05-24 10:29:33","2016-08-22 10:33:15",closed,Other,"Sidewalk Requests","I have been a resident of the Eastern Heights neighborhood since 1978.  Even before I moved into the neighborhood I remember seeing signs  along St. Rd. 45 pleading for sidewalks to be constructed there.  Our children have to ride   the bus to school (even though University School is literally right across the street from our neighborhood) because of the lack of sidewalks and safe crossing of St. Rd. 45.  I know that our area is governed by the Seymour  district of INDOT and that they believe the area does not have enough traffic to warrant a sidewalk.  I also know that the traffic count was completed several years ago in December during I.U.'s winter break and half of the town was gone.  I suspect if they conducted another count during a time with typical traffic, they would find a completely different result.  We have waited long enough for sidewalks.  Now is the time, please!  Thanks for your help in getting this accomplished.",,,Bloomington,IN,,,
151244,"2016-03-28 14:56:35","2016-09-11 22:02:05","2016-08-22 10:33:36",closed,Other,"Sidewalk Requests","I would like to request sidewalks along the 10th Street and a crosswalk from and to University Elementary School at Russel Rd or Tamarron Dr so that more children from neighboring communities can enjoy walking and biking to school. I understand the complications with it being a State road, but with schools and the city promoting healthy living and lifestyle, it seems that a discussion about gaining walking access in this area is important. Not only will it allow our children to walk to school, but it will provide community members in Tamarron, Eastern Heights, and nearby apartments the ability to safely access the bus stops and downtown without using cars.",,"4101-4149 East 10th Street",Bloomington,IN,,39.17361831665039,-86.48215484619140
151249,"2016-03-28 17:04:41","2016-09-11 22:02:05","2016-08-22 10:33:51",closed,Other,"Sidewalk Requests","Sidewalk request for 10th street to make a path to University school
I am a resident of Eastern Heights neighborhood and our community has been in desperate need for sidewalks along 10th Street from E. Etter Drive through to Grandview neighborhood. We also need crosswalks to University Elementary School. We understand the complications with it being a State road, but a meeting is needed to begin the formal process of gaining walking access in this area. Not only will it allow our children to walk to school, but it will provide community members in Tamarron and Eastern Heights the ability to safely walk to the bus stop and access the University and downtown without the use of cars.
Also it is essential that there be a cross walk so that children can safely cross 10th street to get to University Elementary school. 
Thanks for your attention to this important matter.",,,Bloomington,IN,,,
151250,"2016-03-28 18:56:44","2016-09-11 22:02:05","2016-08-22 10:34:06",closed,Other,"Sidewalk Requests","There are no sidewalks along 10th street in the Grandview Hills Neighborhood area and Eastern Heights.  Several years back we tried to get a light/crosswalk across the University School (and the City Church) when there was discussion about widening SR 45E.  I do not know what the plans are for improving SR 45 for the new hospital access and it may include some work that might help this link.  The intersection at 45/Pete Ellis really needs some imporovement for left hand turns (even more with hospital coming!)",,,Bloomington,IN,,,
151251,"2016-03-28 21:07:50","2016-09-11 22:02:05","2016-08-22 10:35:01",closed,Other,"Sidewalk Requests","Need sidewalks coming up from Smith Road east towards University Elementary",,"4200 E 10th ST",Bloomington,IN,47408,39.17458343505859,-86.48110198974610
151559,"2016-04-12 18:01:37","2016-09-11 22:02:05","2016-04-13 08:58:16",closed,Other,"Sidewalk Requests","Metal piece bent at dangerous angle sticking out of sidewalk on east side of Woodlawn a little way north of 2nd.","Street Department",,Bloomington,IN,,,
151616,"2016-04-18 09:44:00","2019-01-10 09:02:39","2016-05-05 09:14:43",closed,Other,"Sidewalk Requests","On January 13th of this year I sustained a fall on the sidewalk on N Washington St. between 6th and 5th street. My shoulder was hurt when I broke the fall and is still sore as of 4/18/16. The fall was caused by ice on the drain cover crossing the sidewalk. The covers on that block are smooth aluminum with no grids for traction. It was covered by clear ice so I couldn't see it. A postal carrier was close behind me and he helped me to my feet. He said those drain covers were a hazard to him as well.  I have waited thinking my right shoulder would improve but it has not. What is the city's policy for this kind of injury? I'd prefer not to have to pursue civil litigation to correct this.",,,Bloomington,IN,,,
152514,"2016-04-25 15:33:12","2016-09-11 22:02:05","2016-05-10 11:29:02",closed,Other,"Sidewalk Requests","Side walk is becoming Hazardous on West side of Allendale and Winslow Road. Exact Location Beyond fence line of 1341 E Bradshire St and Lighthouse Christian Church Exit on Winslow Road.","Street Department",,Bloomington,IN,,,
152544,"2016-04-27 11:22:01","2016-09-11 22:02:05","2016-05-04 14:09:37",closed,Other,"Sidewalk Requests","Our ~30 year old sidewalk is damaged and unsafe for children, the elderly, and people who aren't watching where they're going","Street Department","2626 E Poplar DR",Bloomington,IN,47401,39.13658142089844,-86.50178527832031
152574,"2016-04-27 16:34:51","2016-09-11 22:02:05","2016-06-02 09:37:10",closed,Other,"Sidewalk Requests","Could someone please look at the broken sidewalk located on the street level at 1955 N. College Ave. The sidewalk was broken in several areas when the retention pond was built between Walnut and College. The sidewalk has been a hazard for years. Thanks.","Street Department","1915-1955 North Old State Road 37",Bloomington,IN,,39.18378829956055,-86.53521728515625
152846,"2016-05-11 10:26:15","2016-09-11 22:02:05","2016-05-11 12:19:07",closed,Other,"Sidewalk Requests","Constituent request for sidewalk at South Moore's Pike/Smith Rd. The constituent saw people walking on the side of the road and were concerned the people might get hit. The request was seen on Twitter, and was retweeted by 3 other constituents.","Street Department",,Bloomington,IN,,,
153248,"2016-06-02 07:43:36","2016-09-11 22:02:05","2016-06-03 07:07:38",closed,Other,"Sidewalk Requests","Follow-up Report: Please review this request to address a broken curb, approximately 40 inches of street contact curb is missing.  This was verbally reported about one month ago, no follow-up to date.  Please see picture and advise as to responsibility.  Thank you, Mike Baldomero, Property Manager Olympus Properties","Street Department",,Bloomington,IN,,,
153483,"2016-06-13 18:51:46","2016-09-11 22:02:05","2016-06-15 12:55:49",closed,Other,"Sidewalk Requests","Hello, we have some sidewalks that need attention in Sherwood Green and I would like to speak with someone from the City about them please.  Thank you!","Street Department",,Bloomington,IN,,,
153534,"2016-06-15 10:04:38","2016-09-11 22:02:05","2016-08-22 10:29:07",closed,Other,"Sidewalk Requests","I am a pedestrian who commutes to work about 1.3 miles northbound on Wooodlawn Monday-Friday.  Usually I scurry quickly up that street as I'm running late; sometimes I jog.  But once I get to the part of Woodlawn that borders Bryan Park, I am loathe to get myself onto the park trail during my hasty commute for a few reasons:

1. The Bryan Park trail is a park trail, not a sidewalk.

2. This trail doesn't go straight northward, so it is a waste of my time to follow it.

3. My commute is at 7:15am when few people are out, making things unnecessarily scary for trail users when I'm quickly approaching them from behind.  This is especially true during colder months when it is dark out, and also when I'm carrying my umbrella, which looks not unlike some sort of a weapon.  (Its just an Ikea umbrella.)

This morning I was yelled at for the second time by another motorist who was displeased with my choosing to walk on Woodlawn Avenue northbound past Bryan Park.  ""There's a sidewalk over there!"" he shouted.  I had wanted to correct him and point out that its a park trail, but I didn't.  Who knows which maniac who shouts at pedestrians from their car isn't more dangerous, you know?

It would be great if there were a sidewalk that ran alongside Woodlawn Avenue past Bryan Park.  I'm not the only person who chooses to walk up the road instead of the park trail, but I admit that there are not many of us, at least at 7:15am.

Let me end by saying that I am not holding out hope for a sidewalk; this probably isn't a great concern for the city.  But I can't guarantee that annoyed motorists will convince me to change my path, either.

In any case: thank you for reading and considering my request.  Have a nice day.

Nicholas Roberts",,"925-989 South Woodlawn Avenue",Bloomington,IN,,39.15616607666016,-86.52256774902344
153826,"2016-06-30 13:36:08","2016-09-11 22:02:05","2016-07-11 10:10:34",closed,Other,"Sidewalk Requests","I took a little tumble on the sidewalk downtown on Kirkwood this morning coming back from the bank.  It's just starting to hurt so I thought I'd notify you encase something turns up broken later. I'm not a big fan of those brick sidewalks, they're uneven and slick in the rain and snow.","Street Department",,Bloomington,IN,,,
154107,"2016-07-16 11:32:51","2016-09-11 22:02:05","2016-08-11 07:14:27",closed,Other,"Sidewalk Requests","at 933 S. Fenbrook Court, a section of sidewalk has dropped 2 3/4 inches - another place has dropped 3/4 inches","Street Department","937 S Fenbrook CT",Bloomington,IN,47401,39.15515136718750,-86.48118591308594
154245,"2016-07-24 14:19:24","2016-09-11 22:02:05","2016-07-25 08:44:37",closed,Other,"Sidewalk Requests","Requesting a sidewalk connecting the Arlington pedestrian crossing overpass with the sidewalk along Gourley Pike West of Kinser Pike. The blind curve on Gourley Pike on this route makes it especially hazardous for me in my power wheelchair given my need to operate clear of the roadway edge due to rollover hazard and inability to yield to oncoming traffic by exiting the motorway.",,,Bloomington,IN,,,
154589,"2016-08-05 16:13:21","2016-09-11 22:02:05","2016-08-11 12:48:51",closed,Other,"Sidewalk Requests","two sections of the sidewalk are sloped together so that water pools immediately after a rain. It is a heavily walked sidewalk and the puddle is definitely an inconvenience. I'm considering work on my driveway; can I/should I have the contractor improve the situation? Do I need city approval?","Planning and Transportation","200 East 2nd Street",Bloomington,IN,,39.16134262084961,-86.53208160400390
155002,"2016-08-21 20:19:38","2016-09-11 22:02:05","2016-08-26 10:46:44",closed,Other,"Sidewalk Requests","Owner has set up a drain from the basement of this house that dumps directly on the sidewalk in front of the house. The sidewalk has been a muddy mess of standing water and a fall hazard ever since. Is this a violation of city code? It seems like it would break down the side walk over time and ,again, be a fall hazard due to the muddy mess.","Planning and Transportation","1101 S Henderson ST",Bloomington,IN,47401,39.15402221679688,-86.52689361572266
155087,"2016-08-23 12:32:39","2018-01-25 10:41:06","2016-09-28 07:10:39",closed,Other,"Sidewalk Requests","vegetation needs to be trimmed back from sidewalk.  over-growth blocks sidewalk.","Street Department","1357 S Liberty DR",Bloomington,IN,47403,39.15703582763672,-86.57522583007812
155806,"2016-09-12 12:35:58","2018-01-25 10:39:05","2016-09-14 00:00:00",closed,Other,"Sidewalk Requests","sidewalk damaged after brush cleared away with a machine.  this is the only sidewalk along tapp rd this side of rockport.  It is hidden from street, but still used.  tx","Street Department","1736-1890 West Tapp Road",Bloomington,IN,,39.13645553588867,-86.55140686035156
156055,"2016-09-20 09:31:48","2016-09-28 07:07:32","2016-09-28 07:07:32",closed,Other,"Sidewalk Requests","The sidewalk on 9th between Grant and Lincoln St.  is crumbling and falling apart.","Street Department",,Bloomington,IN,,39.17045974731445,-86.53009033203125
156059,"2016-09-20 09:35:24","2016-10-06 08:00:54","2016-10-06 08:00:54",closed,Other,"Sidewalk Requests","The alley between 423 and 425 S grant st needs some attention. There are pot holes and many bad areas. We have repaved our lots already.","Street Department","408 S Grant ST",Bloomington,IN,47401,39.16241455078125,-86.53012084960938
156576,"2016-10-16 23:22:05","2017-08-17 11:51:08","2017-08-17 11:51:08",closed,Other,"Sidewalk Requests","The sidewalk in front of our house has many cracks.  Some of the places it is cracked are raised up a few inches which can cause tripping.  In addition, we have pipes that run under our sidewalk and out to the street to connect to the main sewer.  The clay pipe that runs under the sidewalk has roots growing into it.  In order to replace the pipe we need to take out the sidewalk.  We are hoping that since the sidewalk needs replacing anyway, the city could let us know when the sidewalk will be torn up and replaced so we can have our plumber ready to replace the pipe while the sidewalk is up.  Thank you for staying in communication with us about when the sidewalk will be replaced with a safer one.","Street Department","909 S Lincoln ST",Bloomington,IN,47401,39.15592956542969,-86.53125000000000
156757,"2016-10-25 12:50:47","2016-11-16 10:47:01","2016-11-16 10:47:01",closed,Other,"Sidewalk Requests","Ornamental grass completely obstructs sidewalk, and forces pedestrians to walk on uneven ground. Very dangerous in the early morning when it's dark and the ground is not visible. I nearly fell here this morning.",,"2313 East Woodbine Drive",Bloomington,IN,,39.15641784667969,-86.50230407714844
156759,"2016-10-25 16:21:03","2016-11-02 09:16:51","2016-11-02 09:16:51",closed,Other,"Sidewalk Requests","We have a sidewalk already, but I have a question about modifying it.  We are considering having some drainage work done on our property and would like a drain/grate through the sidewalk to help with water draining.  We've seen some in the sidewalks along Blair Ave. and were curious about how to have one installed.  If this is not under your area, would you please pass along this email to the appropriate person or committee.  Thank you for your time!","Planning and Transportation","821 N Blair AVE",Bloomington,IN,47404,39.17406845092773,-86.54385375976562
156808,"2016-10-29 10:40:06","2017-02-27 09:56:50","2017-02-27 09:56:50",closed,Other,"Sidewalk Requests","Missing segment between Gourley and existing sidewalk that goes to College Ave. Today I have to take my chair into the he motorway with monster concrete truck traffic.",,,Bloomington,IN,,,
157112,"2016-11-16 19:34:39","2017-07-25 11:03:39","2017-07-25 11:03:39",closed,Other,"Sidewalk Requests","The sidewalk on the north & east sides of the 4th Street parking garage is in terrible shape.","Public Works Department",,Bloomington,IN,,,
157643,"2017-01-06 16:51:33","2017-01-12 07:18:41","2017-01-12 07:18:41",closed,Other,"Sidewalk Requests","Did not shovel sidewalk",HAND,"4235 E Bill Mallory BLVD",Bloomington,IN,47401,39.15954589843750,-86.47603607177734
157649,"2017-01-09 08:59:14","2017-01-09 09:13:12","2017-01-09 09:13:12",closed,Other,"Sidewalk Requests","Please install sidewalk connecting existing sidewalk and the road on the corner, crossing Branch.",,"1215 W East Branch RD",Bloomington,IN,47403,39.15672683715820,-86.54717254638672
157650,"2017-01-09 09:01:48","2017-01-09 09:12:25","2017-01-09 09:12:25",closed,Other,"Sidewalk Requests","Please complete the sidewalk along Larkspur in between Branch and Greentree. It's been the only uncompleted sidewalk in West Pointe for years.",,"1205-1399 South Larkspur Lane",Bloomington,IN,,39.15646743774414,-86.54746246337890
158071,"2017-02-09 13:29:35","2017-08-17 10:08:24","2017-08-17 10:08:24",closed,Other,"Sidewalk Requests","We received a report from a resident in the neighborhood  that sidewalks across from the empty lots are raised and cracked. 
-Hallmark Rentals and Management","Street Department","3122-3138 East Wyndam Court",Bloomington,IN,,39.14650344848633,-86.49205017089844
158195,"2017-02-21 09:50:25","2017-02-22 14:03:42","2017-02-22 14:03:42",closed,Other,"Sidewalk Requests","I'm trying out a new category since no one reads the other ones I've used. Every time i walk here i have to walk in the street for half a block because people park on the sidewalk (partly because hoosier workwear had concrete blocks that force cars onto the sidewalk)","Parking Enforcement","201–299 S Rogers St",Bloomington,IN,,39.16496658325195,-86.53863525390625
158244,"2017-02-24 18:43:02","2017-03-02 13:56:21","2017-03-02 13:56:21",closed,Other,"Sidewalk Requests","Hello, my name is John Kelly and I am the senior bar manager at Kilroys Sports Bar in Bloomington, Indiana. I apologize if i am sending this request to the wrong department. Essentially, we wanted to get in contact with the city regarding the parking out front of our building during late night hours (11pm-3am). Our hope is that we could put in a request to have those spots blocked off during those times during the school semesters. The reason for this is due to safety. With more and more students being picked up and dropped off at the location by ubers, lyfts, etc, cars are constantly coming and going from the location. Our main concern is that when cars are parked in these spots, students attempting to cross the street or make their way to their respective rides are difficult to see for oncoming traffic. If this is at all possible on a semi-permanent basis going forward or even only for temporary large events such as the Little 500 weekend, please contact me at the email listed above and let me know what we need to do in order to make this happen, if possible. Thank you so much for your help and consideration in this matter!","Planning and Transportation",,Bloomington,IN,,,
158398,"2017-03-09 10:32:13","2017-03-23 09:03:50","2017-03-23 09:03:50",closed,Other,"Sidewalk Requests","A city plow ran aground taking with it the yard and sidewalk.  How can we get this repaired?  Thanks.","Street Department","2128 East Meadow Bluff Court",Bloomington,IN,,39.14254379272461,-86.50703430175781
158411,"2017-03-10 15:11:54","2017-09-01 10:58:55","2017-09-01 10:58:55",closed,Other,"Sidewalk Requests","What the heck is up with this sidewalk repair? It's been torn up for almost a month!  I would hate to be one of the residents in that area with the orange cones and equipment left in the street.  With the decent weather we've had this winter, you'd think projects such as this would be completed quicker.",,"529 E 1st ST",Bloomington,IN,47401,39.15932846069336,-86.52719116210938
158651,"2017-04-05 10:01:01","2017-10-10 09:56:36","2017-10-10 09:56:36",closed,Other,"Sidewalk Requests","We recently moved to Bloomington and chose specifically to live within walking distance to our daughter's school, we're within a mile. Unfortunately, there's no viable route to her school b/c there are no sidewalks adjacent to University Elementary on 10th street.  This is a significant issue for the surrounding community.  We're new so I don't have all the numbers but there are at least 10 students at University in our neighborhood alone and based it's a safe assumption that the neighboring neighborhoods have a large number of students who are not currently provided with a safe alternative.  For a city with a great walkable/bikable reputation I would expect this to be a high priority for our city.  This is also a common route for cyclists (recreational and competitive) and seems like it would have already been addressed.  Please advise.",,"4098 East 10th Street",Bloomington,IN,,39.17318725585938,-86.48229980468750
159163,"2017-05-21 21:33:34","2017-05-23 13:20:13","2017-05-23 13:20:13",closed,Other,"Sidewalk Requests","The city fixed a busted pipe this winter and tore up the sidewalk. It is now May and the side walk is still torn up.  Please fix.","Utilities T & D","2128 East Meadow Bluff Court",Bloomington,IN,,39.14239120483398,-86.50698089599610
159411,"2017-05-31 11:22:57","2017-06-02 10:07:16",,open,Other,"Sidewalk Requests","I live at 1009 S. Lincoln St., and running in a perpendicular line to the street from our water access, at the house edge of the sidewalk, there's a big hole. It seems to go below the sidewalk a little. I'm not sure if I should just fill it in, or if it is indicative of a larger problem that should be addressed. I'd love a little guidance from the experts! Thanks!",,,Bloomington,IN,,,
159425,"2017-05-31 14:16:43","2017-10-10 09:55:33","2017-10-10 09:55:33",closed,Other,"Sidewalk Requests","I totally appreciate the desire of the city to annex more city to provide city services.  I grew up on S Hays Drive and sidewalks would have been great.  However, now I live IN the city and I still have no sidewalks.  I would LOVE all the streets in Bryan Park Neighborhood to have sidewalks.  The way they were done for the newer S Dunn street houses is great with the recessed street parking.  Why can't one of Bloomington's oldest neighborhoods have decent sidewalks?",,"1314 South Grant Street",Bloomington,IN,,39.15165328979492,-86.53034973144531
160997,"2017-09-01 10:39:07","2017-09-01 10:57:12","2017-09-01 10:57:12",closed,Other,"Sidewalk Requests","Incomplete/no sidewalk on side of road travelling on Allen from Strong Drive to Adams",,"1334-1360 West Allen Street",Bloomington,IN,,39.15581893920898,-86.54882049560547
161264,"2017-09-21 12:45:29","2017-11-21 14:23:47","2017-11-21 14:23:47",closed,Other,"Sidewalk Requests","Upended sidewalk on 2nd street, especially on south side of 2nd at corner of Ballantine, but also further west on 2nd.  As elderly people, we find this absolutely treacherous! Sorry we can't send a photo; we have ""dumb"" phones.  Thank you!","Street Department",,Bloomington,IN,,,
161467,"2017-10-06 11:17:44","2017-10-12 12:41:18","2017-10-12 12:41:18",closed,Other,"Sidewalk Requests","Crumbling sidewalk with loose gravel on left side of Autumn Drive between house number 2208 and 2218. Hazardous.. I have tripped and fallen twice as I walk my dogs. Second time I have reported this problem. I'm 74 and don't want to break a hip!!","Street Department",,Bloomington,IN,,,
